"","Case No.","Claimant(s)","Respondent(s)","Status","claimants","outcome","registered","bit","instrument","claim_id"
"354","ARB(AF)/05/1","Bayview Irrigation District and others","United Mexican States","Concluded","Bayview Irrigation District #11 (U.S.), Arthur E. Beckwith (U.S.), Bownsville Irrigation District (U.S.), Luther Bradford (U.S.), Cameron County Irrigation District #2 (U.S.), Cameron County Irrigation District #6 (U.S.), Capote Farms,  Ltd. (formerly Capote Farms,  Inc.) (U.S.), Delta Lake Irrigation District (U.S.), Donna Irrigation District Hidalgo County #1 (U.S.), Richard Drawe (U.S.), Electric Gin Company of San Benito (U.S.), Odus D. Emery Jr. (U.S.), Engelman Irrigation District (U.S.), Estate of E.F. Davis Jr. (U.S.), Willard Fike (U.S.), Fike Farms (U.S.), Fuller Farms (U.S.), Hidalgo & Cameron County Irrigation District #9 (U.S.), Hidalgo County Irrigation District #1 (U.S.), Hidalgo County Irrigation District #2 (U.S.)","Award rendered on June 19, 2007.","July 1, 2005","","NAFTA (North American Free Trade Agreement)",185
"355","ARB/05/11","Asset Recovery Trust S.A.","Argentine Republic","Concluded","Asset Recovery Trust S.A.  (Argentine)","The Tribunal issues a procedural order for the discontinuance of the proceeding for lack of payment of the required advances, pursuant to ICSID Administrative and Financial Regulation 14(3)(d) on November 27, 2012.","June 23, 2005","BIT United States of America - Argentina 1991","",184
"356","ARB/05/10","Malaysian Historical Salvors, SDN, BHD","Malaysia","Concluded","Malaysian Historical Salvors,  SDN,  BHD (Malaysian)","Award rendered on May 17, 2007.","June 14, 2005","BIT Malaysia - United Kingdom of Great Britain and Northern Ireland 1981","",183
"357","ARB/05/9","Empresa Eléctrica del Ecuador, Inc. (EMELEC)","Republic of Ecuador","Concluded","Empresa Eléctrica del Ecuador,  Inc. (EMELEC)  (U.S.)","Award rendered on June 2, 2009.","May 26, 2005","BIT Ecuador - United States of America 1993","",182
"358","CONC/05/1","Togo Electricité","Republic of Togo","Concluded","Togo Electricité (nationality not available)","Report of the Commission issued on April 6, 2006.","May 20, 2005","","",181
"359","ARB/05/8","Parkerings-Compagniet AS","Republic of Lithuania","Concluded","Parkerings-Compagniet AS (Norwegian)","Award rendered on September 11, 2007.","May 16, 2005","BIT Lithuania - Norway 1992","",180
"360","ARB/05/7","Saipem S.p.A.","People's Republic of Bangladesh","Concluded","Saipem S.p.A.  (Italian)","Award rendered on June 30, 2009.","April 25, 2005","BIT Bangladesh - Italy 1990","",179
"361","ARB/05/6","Bernardus Henricus Funnekotter and others","Republic of Zimbabwe","Concluded","Lion Hellmut Benjamins (Dutch), Dicky Roelanda Breytenbach (Dutch), Carel Frederik des Tombe (Dutch), Romelia Gwendolyn Fisher (Dutch), Bernardus Henricus Funnekotter (Dutch), Erica Hansen (Dutch), Hermannes van Duren (Junior) (Dutch), Margareta van Duren (Dutch), Max Willem Arthur Graaf van Rechteren Limpurg (Dutch), Rolf Jan Philip Walraven (Dutch), Johan Pieter Weller (Dutch), Loekie Weller (Dutch), Wessel Johannes Weller (Dutch)","Award rendered on April 22, 2009.","April 15, 2005","BIT Netherlands - Zimbabwe 1996","",178
"362","ARB/05/5","TSA Spectrum de Argentina, S.A.","Argentine Republic","Concluded","TSA Spectrum de Argentina S.A.  (Argentine)","Award rendered on December 19, 2008; attached to the award is a dissenting opinion by one arbitrator and a concurring opinion by one arbitrator.","April 8, 2005","BIT Netherlands - Argentina 1992","",177
"363","ARB/05/4","I&I Beheer B.V.","Bolivarian Republic of Venezuela","Concluded","I & I Beheer B.V. (Dutch)","Proceeding discontinued (Order taking note of the discontinuance issued by the Tribunal on December 28, 2007 in accordance with Article 44 of the ICSID Convention).","April 6, 2005","BIT Netherlands - Venezuela,  Republica Bolivariana de 1991, ","Investment Law - Venezuela (1999)",176
"364","ARB/05/3","LESI, S.p.A. and Astaldi, S.p.A.","People's Democratic Republic of Algeria","Concluded","Astaldi,  S.p.A.  (Italian), LESI,  S.p.A. (Italian)","Award rendered on November 12, 2008. ","March 18, 2005","BIT Algeria - Italy 1991","",175
"365","ARB/05/2","Compañía General de Electricidad S.A. and CGE Argentina S.A.","Argentine Republic","Concluded","CGE Argentina S.A.  (Chilean), Compañía General de Electricidad S.A.  (Chilean)","Settlement agreed by the parties and proceeding discontinued at the request of the Claimants (Order taking note of the discontinuance issued by the Tribunal pursuant to ICSID Arbitration Rule 44 on July 28, 2009).","February 4, 2005","BIT Chile - Argentina 1991","",174
"366","ARB/05/1","Daimler Financial Services AG","Argentine Republic","Concluded","Daimler Financial Services AG (German), DaimlerChrysler Services AG (German)","The Tribunal renders its award; attached to the award is a dissenting opinion by arbitrator Charles N. Brower and a separate opinion by arbitrator Domingo Bello Janeiro.","January 14, 2005","BIT Germany - Argentina 1991","",173
"367","ARB/04/21","Motorola Credit Corporation, Inc","Republic of Turkey","Concluded","Motorola Credit Corporation,  Inc. (U.S.)","Settlement agreed by the parties and proceeding discontinued at their request (Order taking note of the discontinuance issued by the Tribunal on November 21, 2005 pursuant to Arbitration Rule 43(1)).","December 28, 2004","BIT Turkey - United States of America 1985","",172
"368","ARB/04/20","RGA Reinsurance Company","Argentine Republic","Concluded","RGA Reinsurance Company  (U.S.)","Settlement agreed by the parties and proceeding discontinued at their request (Order taking note of the discontinuance issued by the Tribunal on September 14, 2006 pursuant to Arbitration Rule 43(1)).","November 11, 2004","BIT United States of America - Argentina 1991","",171
"369","ARB(AF)/04/6","Vannessa Ventures Ltd.","Bolivarian Republic of Venezuela","Concluded","Vannessa Ventures Ltd.  (Canadian)","Award rendered on January 16, 2013.","October 28, 2004","BIT Canada - Venezuela,  Republica Bolivariana de 1996","",170
"370","ARB/04/19","Duke Energy Electroquil Partners and Electroquil S.A.","Republic of Ecuador","Concluded","Duke Energy Electroquil Partners (U.S.), Electroquil S.A. (Ecuadoran)","Award rendered on August 18, 2008.","October 7, 2004","BIT Ecuador - United States of America 1993, ","Contract",169
"371","ARB(AF)/04/5","Archer Daniels Midland Company and Tate & Lyle Ingredients Americas, Inc.","United Mexican States","Concluded","Respondent(s)","Order of the Consolidation Tribunal rendered on May 20, 2005.","September 8, 2004 (Respondent(s))","","NAFTA (North American Free Trade Agreement)",168
"372","ARB(AF)/04/3","Gemplus, S.A., SLP, S.A. and Gemplus Industrial, S.A. de C.V.","United Mexican States","Concluded","Gemplus,  S.A. (French), SLP,  S.A. (French), Gemplus Industrial,  S.A. de C.V. (Mexican)","Award rendered on June 16, 2010.","September 29, 2004","BIT Mexico - France 1998","",167
"373","ARB(AF)/04/4","Talsud, S.A.","United Mexican States","Concluded","Talsud,  S.A.  (Argentine)","Award rendered on June 16, 2010.","September 29, 2004","BIT Mexico - Argentina 1996","",166
"374","ARB/04/18","France Telecom S.A.","Argentine Republic","Concluded","France Telecom S.A. (French)","Settlement agreed by the parties and proceeding discontinued at the request of the Claimant (Order taking note of the discontinuance issued by the Acting Secretary-General pursuant to ICSID Arbitration Rule 44 on March 29, 2006).","August 26, 2004","BIT France - Argentina 1991","",165
"375","ARB/04/17","Interbrew Central European Holding B.V.","Republic of Slovenia","Concluded","Interbrew Central European Holding B.V. (Dutch)","Settlement agreed by the parties and proceeding discontinued at the request of the Claimant (Order taking note of the discontinuance issued by the Tribunal  pursuant to ICSID Arbitration Rule 44 on July 18, 2005).","August 25, 2004","BIT Slovenia - Netherlands 1996","",164
"376","ARB/04/16","Mobil Exploration and Development Inc. Suc. Argentina and Mobil Argentina S.A.","Argentine Republic","Pending","Mobil Argentina S.A. (Argentine), Mobil Exploration and Development Inc. Suc. Argentina (U.S.)","","August 5, 2004","BIT United States of America - Argentina 1991","",163
"377","ARB/04/15","Telenor Mobile Communications AS","Republic of Hungary","Concluded","Telenor Mobile Communications AS  (Norwegian)","Award rendered on September 13, 2006.","August 2, 2004","BIT Hungary - Norway 1991","",162
"378","ARB/04/14","Wintershall Aktiengesellschaft","Argentine Republic","Concluded","Wintershall Aktiengesellschaft  (German)","Award rendered on December 8, 2008.","July 15, 2004","BIT Germany - Argentina 1991","",161
"379","ARB(AF)/04/2","Cargill, Incorporated","Republic of Poland","Concluded","Cargill,  Incorporated (U.S.)","Settlement on jurisdiction agreed by the parties on March 10, 2005 and proceeding discontinued at their request (Order taking note of the discontinuance of the proceeding pursuant to Arbitration Rule 49(1) of the Additional Facility Rules issued by the Tribunal on April 4, 2005.) At the request of the parties, and with the Tribunal's consent, the proceeding continues with the same Tribunal under the UNCITRAL Arbitration Rules.","July 7, 2004","BIT United States of America - Poland 1990","",160
"380","ARB/04/13","Jan de Nul N.V. and Dredging International N.V.","Arab Republic of Egypt","Concluded","Dredging International N.V.  (Belgian), Jan de Nul N.V. (Belgian)","Award rendered on November 6, 2008.","May 27, 2004","BIT Egypt,  Arab Republic of - Belgium-Luxembourg 1977, BIT Egypt,  Arab Republic of - Belgium-Luxembourg 1999","",159
"381","ARB/04/12","ABCI Investments Limited","Republic of Tunisia","Pending","ABCI Investments Limited (Dutch)","","April 6, 2004","BIT Netherlands - Tunisia 1998, ","Investment Law - Tunisia (1969)",158
"382","ARB/04/11","Russell Resources International Limited and others","Democratic Republic of the Congo","Concluded","Russell Resources Congo SPRL  (Congolese (D.R.)), Russell Resources International Limited (Maltese), Russell Resources Pty Limited (Australian)","The Tribunal issues an order for the discontinuance of the proceeding on February 10, 2009, for lack of payment of the required advances, pursuant to ICSID Administrative and Financial Regulation 14(3)(d).","April 6, 2004","","Contract",157
"383","ARB/04/10","Alstom Power Italia SpA and Alstom SpA","Republic of Mongolia","Concluded","Alstom SpA  (Italian), Alstom Power Italia SpA (Italian)","Settlement agreed by the parties and proceeding discontinued at their request (Order taking note of the discontinuance issued by the Tribunal on March 13, 2006 pursuant to Arbitration Rule 43(1)).","March 18, 2004","BIT Italy - Mongolia 1993, ","ECT (Energy Charter Treaty)",156
"384","ARB/04/8","BP America Production Company and others","Argentine Republic","Concluded","BP America Production Company (U.S.), Pan American Continental S.R.L. (Argentine), Pan American Fueguina S.R.L. (Argentine), Pan American Sur S.R.L. (Argentine)","Settlement agreed by the parties and proceeding discontinued at their request (Order taking note of the discontinuance issued by the Tribunal on August 20, 2008 pursuant to Arbitration Rule 43(1)). ","February 27, 2004","BIT United States of America - Argentina 1991","",155
"385","ARB/04/9","CIT Group Inc.","Argentine Republic","Concluded","CIT Group Inc.  (U.S.)","The Tribunal issues an order taking note of the discontinuance of the proceeding pursuant to ICSID Arbitration Rule 44 on May 12, 2009.","February 27, 2004","BIT United States of America - Argentina 1991","",154
"386","ARB/04/7","Sociedad Anónima Eduardo Vieira","Republic of Chile","Concluded","Sociedad Anónima Eduardo Vieira (Spanish)","Award rendered on August 21, 2007; attached to the award is a Dissenting Opinion by one of the arbitrators.","February 27, 2004","BIT Chile - Spain 1991","",153
"387","ARB/04/6","OKO Pankki Oyj and others","Republic of Estonia","Concluded","OKO Osuuspankkien Keskuspankki Oyj (Finnish), OKO Pankki Oyj (Finnish), Ost-West Handelsbank AG (German), Sampo Bank Plc (Finnish), VTB BANK (Deutschland) AG (German)","Award rendered on November 19, 2007.","February 20, 2004","BIT Estonia - Finland 1992, BIT Estonia - Germany 1992","",152
"388","ARB/04/5","Compagnie d'Exploitation du Chemin de Fer Transgabonais","Gabonese Republic","Concluded","Compagnie d'Exploitation du Chemin de Fer Transgabonais (Gabonese)","Award rendered on March 7, 2008.","February 10, 2004","","Contract",151
"389","ARB/04/3","Cemex Asia Holdings Ltd","Republic of Indonesia","Concluded","Cemex Asia Holdings Ltd. (Singaporean)","Settlement agreed by the parties and settlement recorded at their request in the form of an award (Award embodying the parties' settlement agreement rendered on February 23, 2007, pursuant to Arbitration Rule 43(2)).","January 27, 2004","","Contract, ASEAN Treaty 1987 (Association of Southeast Asian Nations Agreement for the Promotion and Protection of Investment)",150
"390","ARB/04/4","SAUR International","Argentine Republic","Pending","SAUR International  (French)","Award rendered on May 22, 2014.","January 27, 2004","BIT France - Argentina 1991","",149
"391","ARB(AF)/04/1","Corn Products International, Inc.","United Mexican States","Concluded","Corn Products International,  Inc.  (U.S.)","Award rendered on August 18, 2009.","January 26, 2004","","NAFTA (North American Free Trade Agreement)",148
"392","ARB/04/2","Western NIS Enterprise Fund","Ukraine","Concluded","Western NIS Enterprise Fund (U.S.)","Settlement agreed by the parties and proceeding discontinued at their request (Order taking note of the discontinuance issued by the Tribunal on June 1, 2006 pursuant to Arbitration Rule 43(1)).","January 26, 2004","BIT Ukraine - United States of America 1994","",147
"393","ARB/04/1","Total S.A.","Argentine Republic","Pending","Total S.A.  (French)","Award rendered on November 27, 2013.","January 22, 2004","BIT France - Argentina 1991","",146
"394","ARB/03/30","Azurix Corp.","Argentine Republic","Concluded","Azurix Corp.  (U.S.)","The Tribunal issues a procedural order for the discontinuance of the proceeding for lack of payment of the required advances, pursuant to ICSID Administrative and Financial Regulation 14(3)(d) on June 18, 2012.","December 8, 2003","BIT United States of America - Argentina 1991","",145
"395","CONC/03/1","TG World Petroleum Limited","Republic of Niger","Concluded","TG World Petroleum Limited  (Bahamian)","Settlement agreed by the parties and proceeding closed on April 8, 2005 prior to the constitution of a Commission.","December 8, 2003","","Contract",144
"396","ARB/03/29","Bayindir Insaat Turizm Ticaret Ve Sanayi A.S.","Islamic Republic of Pakistan","Concluded","Bayindir Insaat Turizm Ticaret Ve Sanayi A.S.  (Turkish)","Award rendered on August 27, 2009.","December 1, 2003","BIT Turkey - Pakistan 1995","",143
"397","ARB/03/28","Duke Energy International Peru Investments No. 1 Ltd.","Republic of Peru","Concluded","Duke Energy International Peru Investments No. 1 Ltd.  (British)","Award rendered on August 18, 2008; attached to the award are two partial dissenting opinions by two of the arbitrators.","October 24, 2003","","Contract",142
"398","ARB/03/27","Unisys Corporation","Argentine Republic","Pending","Unisys Corporation  (U.S.)","","October 15, 2003","BIT United States of America - Argentina 1991","",141
"399","ARB/03/26","Inceysa Vallisoletana S.L.","Republic of El Salvador","Concluded","Inceysa Vallisoletana S.L. (Spanish)","Award rendered on August 2, 2006.","October 10, 2003","BIT El Salvador - Spain 1995","",140
"400","ARB/03/25","Fraport AG Frankfurt Airport Services Worldwide","Republic of the Philippines","Concluded","Fraport AG Frankfurt Airport Services Worldwide  (German)","Award rendered on August 16, 2007; attached to the award is a Dissenting Opinion by one of the arbitrators.","October 9, 2003","BIT Germany - Philippines 1997","",139
"401","ARB/03/24","Plama Consortium Limited","Republic of Bulgaria","Concluded","Plama Consortium Limited  (Cypriot)","Award rendered on August 27, 2008.","August 19, 2003","BIT Finland - Bulgaria 1997, BIT Cyprus - Bulgaria 1987, ","ECT (Energy Charter Treaty)",138
"402","ARB/03/23","EDF International S.A., SAUR International S.A. and León Participaciones Argentinas S.A.","Argentine Republic","Pending","EDF International S.A. (French), León Participaciones Argentinas S.A.  (French), SAUR International S.A. (Luxembourg)","The Tribunal renders its award on June 11, 2012.","August 12, 2003","BIT Argentina - Belgium-Luxembourg 1990, BIT France - Argentina 1991","",137
"403","ARB/03/22","Electricidad Argentina S.A. and EDF International S.A.","Argentine Republic","Pending","EDF International S.A. (French), Electricidad Argentina S.A. (Argentine)","","August 12, 2003","BIT France - Argentina 1991","",136
"404","ARB/03/21","Enersis S.A. and others","Argentine Republic","Pending","Chilectra S.A. (Chilean), Elesur S.A. (Chilean), Empresa Nacional de Electrecidad S.A. (Chilean), Enersis S.A. (Chilean)","","July 22, 2003","BIT Chile - Argentina 1991","",135
"405","ARB/03/20","Telefónica S.A","Argentine Republic","Concluded","Telefónica S.A (Spanish)","Settlement agreed by the parties and proceeding discontinued at their request (Order taking note of the discontinuance issued by the Tribunal on September 24, 2009 pursuant to ICSID Arbitration Rule 43(1)).","July 21, 2003","BIT Spain - Argentina 1991","",134
"406","ARB/03/16","ADC Affiliate Limited and ADC & ADMC Management Limited","Republic of Hungary","Concluded","ADC Affiliate Limited and ADC & ADMC Management Limited  (Cypriot), ADC Affiliate Limited (Cypriot)","Award rendered on October 2, 2006","July 17, 2003","BIT Cyprus - Hungary 1989","",133
"407","ARB/03/18","Aguas Cordobesas S.A., Suez, and Sociedad General de Aguas de Barcelona S.A.","Argentine Republic","Concluded","Aguas Cordobesas S.A. (Argentine), Sociedad General de Aguas de Barcelona S.A.  (Spanish), Suez (French)","Settlement agreed by the parties and proceeding discontinued at the request of the Claimants (Order taking note of the discontinuance issued by the Tribunal pursuant to ICSID Arbitration Rule 44 on January 24, 2007).","July 17, 2003","BIT France - Argentina 1991, BIT Spain - Argentina 1991","",132
"408","ARB/03/17","Suez, Sociedad General de Aguas de Barcelona S.A. and Interagua Servicios Integrales de Agua S.A.","Argentine Republic","Pending","Interagua Servicios Integrales de Agua S.A. (Spanish), Sociedad General de Aguas de Barcelona S.A. (Spanish), Suez (French)","","July 17, 2003","BIT France - Argentina 1991, BIT Spain - Argentina 1991","",131
"409","ARB/03/19","Suez, Sociedad General de Aguas de Barcelona S.A. and Vivendi Universal S.A","Argentine Republic","Concluded","Sociedad General de Aguas de Barcelona S.A. (Spanish), Suez (French), Vivendi Universal S.A. (French)","Award rendered by the Tribunal on April 9, 2015.","July 17, 2003","BIT France - Argentina 1991, BIT Spain - Argentina 1991","",130
"410","ARB/03/15","El Paso Energy International Company","Argentine Republic","Concluded","El Paso Energy International Company  (U.S.)","The Tribunal renders its award on October 31, 2011.","June 12, 2003","BIT United States of America - Argentina 1991","",129
"411","ARB/03/14","Miminco LLC and others","Democratic Republic of the Congo","Concluded","Miminco LLC (U.S.), Ilunga Jean Mukendi (U.S.), John Dormer Tyson (U.S.)","Settlement agreed by the parties and settlement recorded at their request in the form of an award (Award embodying the parties' settlement agreement rendered on November 19, 2007, pursuant to ICSID Arbitration Rule 43(2)).","June 9, 2003","BIT Zaire - United States of America 1984","",128
"412","ARB/03/13","Pan American Energy LLC and BP Argentina Exploration Company","Argentine Republic","Concluded","BP Argentina Exploration Company  (U.S.), Pan American Energy LLC (U.S.)","Settlement agreed by the parties and proceeding discontinued at their request (Order taking note of the discontinuance issued by the Tribunal on August 20, 2008 pursuant to Arbitration Rule 43(1)). ","June 6, 2003","BIT United States of America - Argentina 1991","",127
"413","ARB/03/12","Pioneer Natural Resources Company, Pioneer Natural Resources (Argentina) S.A. and Pioneer Natural Resources (Tierra del Fuego) S.A.","Argentine Republic","Concluded","Pioneer Natural Resources (Argentina) S.A. (Argentine), Pioneer Natural Resources Company (U.S.), Pioneer Natural Resources (Tierra del Fuego) S.A. (Argentine)","Settlement agreed by the parties and proceeding discontinued at their request (Order taking note of the discontinuance issued by the Tribunal on June 23, 2005 pursuant to Arbitration Rule 43(1)).","June 5, 2003","BIT United States of America - Argentina 1991","",126
"414","ARB/03/11","Joy Mining Machinery Limited","Arab Republic of Egypt","Concluded","Joy Mining Machinery Limited  (British)","Award rendered on August 6, 2004.","June 2, 2003","BIT Egypt,  Arab Republic of - United Kingdom of Great Britain and Northern Ireland 1975","",125
"415","ARB/03/10","Gas Natural SDG, S.A.","Argentine Republic","Pending","Gas Natural SDG,  S.A.  (Spanish)","","May 29, 2003","BIT United States of America - Argentina 1991, BIT Spain - Argentina 1991","",124
"416","ARB/03/9","Continental Casualty Company","Argentine Republic","Concluded","Continental Casualty Company  (U.S.)","Award rendered on September 5, 2008.","May 22, 2003","BIT United States of America - Argentina 1991","",123
"417","ARB/03/8","Consortium Groupement L.E.S.I. - DIPENTA","People's Democratic Republic of Algeria","Concluded","Consortium Groupement L.E.S.I. - DIPENTA  (Italian)","Award rendered on January 10, 2005.","May 20, 2003","BIT Algeria - Italy 1991","",122
"418","ARB/03/7","Camuzzi International S.A.","Argentine Republic","Concluded","Camuzzi International S.A. (Luxembourg)","Settlement agreed by the parties and proceeding discontinued at their request (Order taking note of the discontinuance issued by the Tribunal on January 25, 2007 pursuant to Arbitration Rule 43(1)).","April 23, 2003","BIT Argentina - Belgium-Luxembourg 1990, BIT United States of America - Argentina 1991","",121
"419","ARB/03/6","M.C.I. Power Group, L.C. and New Turbine, Inc.","Republic of Ecuador","Concluded","M.C.I. Power Group,  L.C. (U.S.), New Turbine,  Inc. (U.S.)","Award rendered on July 31, 2007.","April 8, 2003","BIT Ecuador - United States of America 1993","",120
"420","ARB/03/5","Metalpar S.A. and Buen Aire S.A.","Argentine Republic","Concluded","Buen Aire S.A. (Chilean), Metalpar S.A. (Chilean)","Award rendered on June 6, 2008.","April 7, 2003","BIT Chile - Argentina 1991","",119
"421","ARB/03/4","Industria Nacional de Alimentos, S.A. and Indalsa Perú, S.A. (formerly Empresas Lucchetti, S.A. and Lucchetti Perú, S.A.)","Republic of Peru","Concluded","Empresas Lucchetti,  S.A. (Chilean), Indalsa Perú,  S.A. (Peruvian), Industria Nacional de Alimentos,  S.A. (Chilean), Lucchetti Perú,  S.A. (Peruvian)","Award rendered on February 7, 2005. ","March 26, 2003","BIT Peru - Chile 2000","",118
"422","ARB/03/3","Impregilo S.p.A.","Islamic Republic of Pakistan","Concluded","Impregilo S.p.A. (Italian)","Settlement agreed by the parties and proceeding discontinued at the request of the Claimant (Order taking note of the discontinuance issued by the Tribunal pursuant to ICSID Arbitration Rule 44 on September 26, 2005). ","March 3, 2003","BIT Pakistan - Italy 1997","",117
"423","ARB/03/2","Camuzzi International S.A.","Argentine Republic","Pending","Camuzzi International S.A.  (Luxembourg)","","February 27, 2003","BIT Argentina - Belgium-Luxembourg 1990","",116
"424","ARB/03/1","Ed. Züblin AG","Kingdom of Saudi Arabia","Concluded","Ed. Züblin AG (German)","Settlement agreed by the parties and the proceeding discontinued at the request of the Claimant (Order taking note of the discontinuance issued by the Acting Secretary-General on July 22, 2003 pursuant to Arbitration Rule 44).","January 28, 2003","BIT Saudi Arabia - Germany 1996","",115
"425","ARB/02/18","Tokios Tokeles","Ukraine","Concluded","Tokios Tokelés (Lithuanian)","Award rendered on July 26, 2007; attached to the award is a Dissenting Opinion by one of the arbitrators.","December 20, 2002","BIT Ukraine - Lithuania 1994","",114
"426","ARB/02/17","AES Corporation","Argentine Republic","Pending","AES Corporation  (U.S.)","","December 19, 2002","BIT United States of America - Argentina 1991","",113
"427","ARB/02/16","Sempra Energy International","Argentine Republic","Concluded","Sempra Energy International  (U.S.)","Award rendered on September 28, 2007; attached to the award is a partial dissenting opinion by one of the arbitrators.","December 6, 2002","BIT United States of America - Argentina 1991","",112
"428","ARB/02/15","Ahmonseto, Inc. and others","Arab Republic of Egypt","Concluded","A. BMH & Co.,  Inc. (U.S.), Adel Talebagha (U.S.), Ahmonseto,  Inc. (U.S.), Aida Talebagha (U.S.), Badie Talebagha (U.S.), E&D Industrial California Overseas Company (U.S.), Hala Talebagha (U.S.)","Award rendered on June 18, 2007.","November 18, 2002","BIT United States of America - Egypt,  Arab Republic of 1982","",111
"429","ARB/02/14","CDC Group plc","Republic of Seychelles","Concluded","CDC Group plc  (British)","Award rendered on December 17, 2003.","November 7, 2002","","Contract",110
"430","ARB/02/13","Salini Costruttori S.p.A. and Italstrade S.p.A.","Hashemite Kingdom of Jordan","Concluded","Salini Costruttori S.p.A. (Italian), Italstrade S.p.A. (Italian)","The Tribunal renders its award on January 31, 2006; attached to the award is a separate opinion by Ian Sinclair.","November 7, 2002","BIT Italy - Jordan 1996","",109
