"","Case No.","Claimant(s)","Respondent(s)","Status","claimants","outcome","registered","bit","instrument","claim_id"
"1","ARB/15/33","Gilward Investments B.V.","Ukraine","Pending","Gilward Investments B.V. (nationality not available)","","July 31, 2015","","",538
"2","ARB/15/32","B.V. Belegging-Maatschappij “Far East”","Republic of Austria","Pending","B.V. Belegging-Maatschappij “Far East” (nationality not available)","","July 30, 2015","","",537
"3","ARB/15/31","Gabriel Resources Ltd. and Gabriel Resources (Jersey)","Romania","Pending","Gabriel Resources Ltd.  (nationality not available), Gabriel Resources (Jersey) (nationality not available)","","July 30, 2015","","",536
"4","ARB/15/30","Samsung Engineering Co., Ltd.","Sultanate of Oman","Pending","Samsung Engineering Co.,  Ltd. (Korean)","","July 20, 2015","BIT Korea,  Republic of - Oman 2003","",535
"5","ARB(AF)/15/1","Strabag SE","Libya","Pending","Strabag SE  (nationality not available)","","July 20, 2015","","",534
"6","ARB/15/29","Cortec Mining Kenya Limited, Cortec (Pty) Limited and Stirling Capital Limited","Republic of Kenya","Pending","Cortec Mining Kenya Limited (Kenyan), Cortec (Pty) Limited  (British), Stirling Capital Limited (British)","","July 7, 2015","BIT United Kingdom of Great Britain and Northern Ireland - Kenya 1999","",533
"7","ARB/15/28","Hydro S.r.l. and others","Republic of Albania","Pending","Hydro S.r.l. (nationality not available), Costruzioni S.r.l. (nationality not available), Francesco Becchetti (nationality not available), Mauro De Renzis (nationality not available), Stefania Grigolon (nationality not available), Liliana Condomitti (nationality not available)","","June 29, 2015","","",532
"8","ARB/15/27","JGC Corporation","Kingdom of Spain","Pending"," JGC Corporation (Japanese)","","June 22, 2015","","ECT (Energy Charter Treaty)",531
"9","ARB/15/25","KS Invest GmbH and TLS Invest GmbH","Kingdom of Spain","Pending","KS Invest GmbH (German), TLS Invest GmbH (German)","","June 16, 2015","","ECT (Energy Charter Treaty)",530
"10","ARB/15/26","Nabucco Gas Pipeline International GmbH in Liqu.","Republic of Turkey","Pending","Nabucco Gas Pipeline International GmbH in Liqu. (Austrian)","","June 16, 2015","BIT Austria - Turkey 1988","",529
"11","ARB/15/24","Ali Alyafei","Hashemite Kingdom of Jordan","Pending","Ali Alyafei (Qatari)","","June 11, 2015","BIT Italy - Jordan 1996, ","The Unified Agreement for the Investment of Arab Capital in the Arab States 1980",528
"12","ARB/15/22","ACP Axos Capital GmbH","Republic of Kosovo","Pending","ACP Axos Capital GmbH (German)","","June 4, 2015","BIT Germany - Yugoslavia,  Federal Republic of 1989, ","Investment Law - KOSOVO (2014)",527
"13","ARB/15/23","Matthias Kruck and others","Kingdom of Spain","Pending","Matthias Kruck  (German), Ralf Hofmann (German), Frank Schumm (German), Joachim Kruck (German), Peter Flachsmann (German), Rolf Schumm (German), Karsten Reiss (German), Jürgen Reiss (German)","","June 4, 2015","","ECT (Energy Charter Treaty)",526
"14","ARB/15/20","Cube Infrastructure Fund SICAV and others","Kingdom of Spain","Pending","Cube Infrastructure Fund SICAV (Luxembourg), Cube Energy S.C.A. (Luxembourg), Cube Infrastructure Managers S.A. (Luxembourg), Demeter 2 FPCI (French), Demeter Partners S.A. (French)","","June 1, 2015","","ECT (Energy Charter Treaty)",525
"15","ARB/15/21","Menzies Middle East and Africa S.A. and Aviation Handling Services International Ltd.","Republic of Senegal","Pending","Menzies Middle East and Africa S.A. (Dutch), Aviation Handling Services International Ltd. (British)","","June 1, 2015","BIT United Kingdom of Great Britain and Northern Ireland - Senegal 1980, BIT Senegal - Netherlands 1979, ","Investment Law - Senegal (2004), GATS",524
"16","ARB/15/19","ENERGO-PRO a.s.","Republic of Bulgaria","Pending","ENERGO-PRO a.s. (Czech)","","May 26, 2015","BIT Czech Republic - Bulgaria 1999, ","ECT (Energy Charter Treaty)",523
"17","ARB/15/18","Capital Financial Holdings Luxembourg S.A.","Republic of Cameroon","Pending","Capital Financial Holdings Luxembourg S.A. (nationality not available)","","May 20, 2015","","",522
"18","ARB/15/17","Hanocal Holding B.V. and IPIC International B.V.","Republic of Korea","Pending","Hanocal Holding B.V. (Dutch), IPIC International B.V. (Dutch)","","May 20, 2015","BIT Netherlands - Korea,  Republic of 2003","",521
"19","ARB/15/16","BayWa r.e. Renewable Energy GmbH and BayWa r.e. Asset Holding GmbH","Kingdom of Spain","Pending","BayWa r.e. Renewable Energy GmbH (German), BayWa r.e. Asset Holding GmbH (German)","","May 8, 2015","","ECT (Energy Charter Treaty)",520
"20","ARB/15/15","9REN Holding S.a.r.l","Kingdom of Spain","Pending","9REN Holding S.a.r.l (Luxembourg)","","April 21, 2015","","ECT (Energy Charter Treaty)",519
"21","ARB/15/14","Álvarez y Marín Corporación S.A. and others","Republic of Panama","Pending","Álvarez y Marín Corporación S.A. (Costa Rican), Mr. Cornelis Willem van Noordenne (Dutch), Estudios Tributarios AP S.A. (Costa Rican), Stichting Administratiekantoor Anbadi (Dutch), Mr. Bartus van Noordenne (Dutch)","","April 20, 2015","BIT Netherlands - Panama 2000, ","FTA Central America - Panama 2002",518
"22","ARB/15/13","Devincci Salah Hourani and Issam Salah Hourani","Republic of Kazakhstan","Pending","Mr. Issam Salah Hourani (nationality not available)","","April 16, 2015","","",517
"23","ARB/15/12","PT Ventures, SGPS, S.A.","Republic of Cabo Verde","Pending","PT Ventures,  SGPS,  S.A. (Portuguese)","","April 14, 2015","BIT Cabo Verde - Portugal 1990","",516
"24","ARB/15/11","Total E&P Uganda BV","Republic of Uganda","Pending","Total E&P Uganda BV (Dutch)","","March 20, 2015","BIT Netherlands - Uganda 2000, ","Contract",515
"25","ARB/15/10","Orange SA","Hashemite Kingdom of Jordan","Pending","Orange SA (French)","","March 13, 2015","BIT Jordan - France 1978, ","Investment Law - Jordan (1995)",514
"26","ARB/15/9","Poltava Gas B.V. and Poltava Petroleum Company","Ukraine","Pending"," Poltava Gas B.V. (Dutch), Poltava Petroleum Company (Ukrainian)","","March 11, 2015","BIT Netherlands - Ukraine 1994","",513
"27","ARB/15/8","Aktau Petrol Ticaret A.S. and Som Petrol Ticaret A.S.","Republic of Kazakhstan","Pending","Aktau Petrol Ticaret A.S. (Turkish), Som Petrol Ticaret A.S. (Turkish)","","March 6, 2015","BIT Turkey - Kazakhstan 1992, ","ECT (Energy Charter Treaty)",512
"28","ARB/15/7","WalAm Energy Inc.","Republic of Kenya","Pending","WalAm Energy Inc. (Canadian)","","February 23, 2015","","Contract",511
"29","ARB/15/6","Mobil Investments Canada Inc.","Canada","Pending"," Mobil Investments Canada Inc. (U.S.)","","February 18, 2015","","NAFTA (North American Free Trade Agreement)",510
"30","ARB/15/5","B3 Croatian Courier Coöperatief U.A.","Republic of Croatia","Pending","B3 Croatian Courier Coöperatief U.A.  (Dutch)","","February 3, 2015","BIT Croatia - Netherlands 1998","",509
"31","ARB/15/4","STEAG GmbH","Kingdom of Spain","Pending","STEAG GmbH (German)","","January 21, 2015","","ECT (Energy Charter Treaty)",508
"32","UNCT/15/1","A11Y LTD.","Czech Republic","Pending","A11Y LTD. (British)","","January 16, 2015","BIT United Kingdom of Great Britain and Northern Ireland - Czech Republic 1990","",507
"33","ARB/15/3","Abed El Jaouni and Imperial Holding SAL","Lebanese Republic","Pending","Abed El Jaouni (German), Imperial Holding SAL (Lebanese)","","January 16, 2015","BIT Lebanon - Germany 1997","",506
"34","ARB/15/2","Lighthouse Corporation Pty Ltd and Lighthouse Corporation Ltd, IBC","Democratic Republic of Timor-Leste","Pending","Lighthouse Corporation Pty Ltd (Australian),  Lighthouse Corporation Ltd,  IBC (Seychelles)","","January 14, 2015","","Contract, Investment Law - Timor-Leste  (2005)",505
"35","ARB/15/1","Stadtwerke München GmbH, RWE Innogy GmbH, and others","Kingdom of Spain","Pending","Stadtwerke München GmbH (German), RWE Innogy GmbH (German), RheinEnergie AG (German), AS 3 Beteiligungs GmbH (German), Ferrostaal Industrial Projects GmbH (German), Ferranda GmbH (German), Andasol Fonds GmbH & Co. KG (German), Andasol 3 Kraftwerks GmbH (German), Marquesado Solar S.L. (Spanish)","","January 7, 2015","","ECT (Energy Charter Treaty)",504
"36","ARB/14/35","Baymina Enerji Anonim Sirketi","Boru Hatlari ile Petrol Tasima Anonim Sirketi","Pending","Baymina Enerji Anonim Sirketi (Turkish)","","December 30, 2014","","Contract",503
"37","ARB/14/34","RWE Innogy GmbH and RWE Innogy Aersa S.A.U.","Kingdom of Spain","Pending","RWE Innogy GmbH (German), RWE Innogy Aersa S.A.U. (Spanish)","","December 23, 2014","","ECT (Energy Charter Treaty)",502
"38","ARB/14/33","IBT Group LLC., Constructor, Consulting and Engineering (Panamá), S.A., and International Business and Trade, LLC.","Republic of Panama","Pending","IBT Group LLC. (U.S.), Constructor,  Consulting and Engineering (Panamá),  S.A. (Panamanian), International Business and Trade,  LLC. (U.S.)","","December 19, 2014","BIT Panama - United States of America 2000","",501
"39","ARB/14/32","Casinos Austria International GmbH and Casinos Austria Aktiengesellschaft","Argentine Republic","Pending","Casinos Austria International GmbH (Austrian), Casinos Austria Aktiengesellschaft (Austrian)","","December 18, 2014","BIT Argentina - Austria 1992","",500
"40","ARB/14/31","Tariq Bashir and SA Interpétrol Burundi","Republic of Burundi","Pending","Tariq Bashir (Belgian), SA Interpétrol Burundi (Burundi)","","December 12, 2014","BIT Belgium-Luxembourg - Burundi 1989","",499
"41","ARB/14/30","Beijing Urban Construction Group Co. Ltd.","Republic of Yemen","Pending","Beijing Urban Construction Group Co. Ltd. (Chinese)","","December 3, 2014","BIT China - Yemen,  Republic of 1998","",498
"42","ARB/14/29","Ioan Micula, Viorel Micula and others","Romania","Pending","loan Micula (Swedish), Viorel Micula (Swedish), S.C. Scandic Distilleries S.A. (Romanian), S.C. West Leasing International S.R.L. (Romanian), S.C. Edri Trading S.R.L. (Romanian), S.C. European Drinks S.A. (Romanian), S.C. European Food S.A. (Romanian), S.C. Starmill S.R.L. (Romanian), S.C. multipack S.R.L. (Romanian), S.C. Tonical Trading S.R.L. (Romanian), S.C. Rieni Drinks S.A. (Romanian), S.C. Transilvania General Import-Export S.R.L. (Romanian)","","November 24, 2014","BIT Sweden - Romania 2002","",497
"43","ARB/14/28","Alpiq AG","Romania","Pending","Alpiq AG (Swiss)","","November 17, 2014","BIT Romania - Switzerland 1993, ","ECT (Energy Charter Treaty)",496
"44","ARB/14/26","Albaniabeg Ambient Sh.p.k, M. Angelo Novelli and Costruzioni S.r.l.","Republic of Albania","Pending"," Albaniabeg Ambient Sh.p.k (Albanian), M. Angelo Novelli  (Italian), Costruzioni S.r.l. (Italian)","","November 7, 2014","","ECT (Energy Charter Treaty)",495
"45","ARB/14/27","Zelena N.V. and Energo-Zelena d.o.o Indija","Republic of Serbia","Pending","Zelena N.V.  (Belgian), Energo-Zelena d.o.o Indija (Serbian)","","November 7, 2014","BIT Belgium-Luxembourg - Serbia 2004","",494
"46","ARB/14/25","Ansung Housing Co., Ltd.","People's Republic of China","Pending","Ansung Housing Co.,  Ltd.   (Korean)","","November 4, 2014","BIT China - Korea,  Republic of 2007","",493
"47","ARB/14/24","United Utilities (Tallinn) B.V. and Aktsiaselts Tallinna Vesi","Republic of Estonia","Pending","United Utilities (Tallinn) B.V. (Dutch), Aktsiaselts Tallinna Vesi (Estonian)","","October 24, 2014","BIT Netherlands - Estonia 1992","",492
"48","ARB/14/23","Tamagot Bumi S.A. and Bumi Mauritania S.A.","Islamic Republic of Mauritania","Pending","Tamagot Bumi S.A.  (Mauritanian), Bumi Mauritania S.A. (Mauritanian)","","October 20, 2014","","Contract, Investment Law - Mauritania (2008), Investment Law - Mauritania (2002)",491
"49","ARB/14/22","BSG Resources Limited","Republic of Guinea","Pending","BSG Resources Limited (British)","","September 8, 2014","","Investment Law - Guinea (1987), Investment Law - Guinea (1995)",490
"50","ARB/14/21","Bear Creek Mining Corporation","Republic of Peru","Pending","Bear Creek Mining Corporation (Canadian)","","August 18, 2014","","FTA Canada - Peru 2009",489
"51","ARB/14/20","Sodexo Pass International SAS","Hungary","Pending","Sodexo Pass International SAS (French)","","August 15, 2014","BIT France - Hungary 1986","",488
"52","ARB/14/19","VICAT","Republic of Senegal","Pending","VICAT (French)","","August 5, 2014","BIT Senegal - France 2007","",487
"53","ARB/14/18","RENERGY S.à r.l.","Kingdom of Spain","Pending","RENERGY S.à r.l.  (Luxembourg)","","August 1, 2014","","ECT (Energy Charter Treaty)",486
"54","ARB(AF)/14/3","Corona Materials, LLC","Dominican Republic","Pending","Corona Materials,  LLC  (U.S.)","","July 30, 2014","","CAFTA-DR (Dominican Republic-Central America Free Trade Agreement)",485
"55","ARB/14/17","Krederi Ltd.","Ukraine","Pending","Krederi Ltd. (British)","","July 21, 2014","BIT United Kingdom of Great Britain and Northern Ireland - Ukraine 1993","",484
"56","ARB/14/16","Cyprus Popular Bank Public Co. Ltd.","Hellenic Republic","Pending","Cyprus Popular Bank Public Co. Ltd. (Cypriot)","","July 16, 2014","BIT Cyprus - Greece 1992","",483
"57","ARB/14/15","Nusa Tenggara Partnership B.V. and PT Newmont Nusa Tenggara","Republic of Indonesia","Concluded","Nusa Tenggara Partnership B.V. (Dutch), PT Newmont Nusa Tenggara  (Dutch)","The Secretary-General issues a procedural order taking note of the discontinuance of the proceeding pursuant to ICSID Arbitration Rule 44.","July 15, 2014","BIT Indonesia - Netherlands 1994","",482
"58","ARB/14/14","EuroGas Inc. and Belmont Resources Inc.","Slovak Republic","Pending","EuroGas Inc. (U.S.), Belmont Resources Inc. (Canadian)","","July 10, 2014","BIT Canada - Slovak Republic 2010, BIT United States of America - Slovak Republic 1991","",481
"59","ARB(AF)/14/2","Oded Besserglik","Republic of Mozambique","Pending","Oded Besserglik (South African)","","July 3, 2014","BIT Mozambique - South Africa 1997, ","Investment Law - Mozambique (1993)",480
"60","ARB/14/13","Elektrogospodarstvo Slovenije - razvoj in inzeniring d.o.o.","Bosnia and Herzegovina","Pending","Elektrogospodarstvo Slovenije - razvoj in inzeniring d.o.o. (Slovenian)","","June 16, 2014","BIT Bosnia and Herzegovina - Slovenia 2001, ","ECT (Energy Charter Treaty)",479
"61","ARB/14/12","InfraRed Environmental Infrastructure GP Limited and others","Kingdom of Spain","Pending","InfraRed Environmental Infrastructure GP Limited (British)","","June 3, 2014","","ECT (Energy Charter Treaty)",478
"62","ARB/14/11","NextEra Energy Global Holdings B.V. and NextEra Energy Spain Holdings B.V.","Kingdom of Spain","Pending","NextEra Energy Global Holdings B.V. (Dutch), NextEra Energy Spain Holdings B.V. (Dutch)","","May 23, 2014","","ECT (Energy Charter Treaty)",477
"63","ARB/14/10","Highbury International AVV, Compañía Minera de Bajo Caroní AVV, and Ramstein Trading Inc.","Bolivarian Republic of Venezuela","Pending","Highbury International AVV (Dutch), Ramstein Trading Inc. (Panamanian), Compañía Minera de Bajo Caroní AVV (Dutch)","","May 19, 2014","BIT Netherlands - Venezuela,  Republica Bolivariana de 1991, ","Investment Law - Venezuela (1999)",476
"64","ARB/14/9","City-State N.V., Praktyka Asset Management Company LLC, Crystal-Invest LLC and Prodiz LLC","Ukraine","Pending","City-State N.V. (Dutch), Praktyka Asset Management Company LLC (Ukrainian), Crystal-Invest LLC  (Ukrainian), Prodiz LLC (Ukrainian)","","April 24, 2014","BIT Netherlands - Ukraine 1994","",475
"65","ARB(AF)/14/1","Anglo American PLC","Bolivarian Republic of Venezuela","Pending","Anglo American PLC (British)","","April 10, 2014","BIT Venezuela,  Republica Bolivariana de - United Kingdom of Great Britain and Northern Ireland 1995","",474
"66","ARB/14/8","CEAC Holdings Limited","Montenegro","Pending","CEAC Holdings Limited (Cypriot)","","March 20, 2014","BIT Montenegro - Cyprus 2005","",473
"67","ARB/14/6","African Petroleum Gambia Limited (Block A1)","Republic of The Gambia","Concluded","African Petroleum Gambia Limited (Block A1) (British)","Order taking note of the discontinuance of the proceeding pursuant to ICSID Arbitration Rule 43(1) issued on January 27, 2015.","March 12, 2014","","Contract",472
"68","ARB/14/7","African Petroleum Gambia Limited (Block A4)","Republic of The Gambia","Concluded","African Petroleum Gambia Limited (Block A4) (British)","Order taking note of the discontinuance of the proceeding pursuant to ICSID Arbitration Rule 43(1) issued on January 27, 2015.","March 12, 2014","","Contract",471
"69","ARB/14/5","Infinito Gold Ltd.","Republic of Costa Rica","Pending","Infinito Gold Ltd (Canadian)","","March 4, 2014","BIT Costa Rica - Canada 1998","",470
"70","ARB/14/4","Unión Fenosa Gas, S.A.","Arab Republic of Egypt","Pending","Unión Fenosa Gas,  S.A. (Spanish)","","February 27, 2014","BIT Egypt,  Arab Republic of - Spain 1992","",469
"71","ARB/14/3","Blusun S.A., Jean-Pierre Lecorcier and Michael Stein","Italian Republic","Pending","Blusun S.A. (Belgian), Jean-Pierre Lecorcier (French), Michael Stein (German)","","February 21, 2014","","ECT (Energy Charter Treaty)",468
"72","ARB/14/2","Michael Dagher","Republic of the Sudan","Pending","Michael Dagher (Jordanian, Lebanese)","","February 21, 2014","BIT Sudan - Jordan 2000, BIT Sudan - Lebanon 2004","",467
"73","ARB/14/1","Masdar Solar & Wind Cooperatief U.A.","Kingdom of Spain","Pending","Masdar Solar & Wind Cooperatief U.A. (Dutch)","","February 11, 2014","","ECT (Energy Charter Treaty)",466
"74","ARB/13/38","Fouad Alghanim & Sons Co. for General Trading & Contracting, W.L.L. and Mr. Fouad Mohammed Thunyan Alghanim","Hashemite Kingdom of Jordan","Pending","Fouad Mohammed Thunyan Alghanim (Kuwaiti), Fouad Alghanim & Sons Co. for General Trading & Contracting,  W.L.L. (Kuwaiti)","","December 24, 2013","BIT Jordan - Kuwait 2001","",465
"75","ARB/13/37","Utsch M.O.V.E.R.S. International GmbH, Erich Utsch Aktiengesellschaft, and Mr. Helmut Jungbluth","Arab Republic of Egypt","Pending","Erich Utsch Aktiengesellschaft (German), Helmut Jungbluth (German), Utsch M.O.V.E.R.S. International GmbH (German)","","December 24, 2013","BIT Egypt,  Arab Republic of - Germany 2005","",464
"76","ARB/13/35","Le Chèque Déjeuner and C.D Holding Internationale","Hungary","Pending","C.D Holding Internationale  (French), Le Chèque Déjeuner (French)","","December 23, 2013","BIT France - Hungary 1986","",463
"77","ARB/13/34","Courts (Indian Ocean) Limited and Courts Madagascar S.A.R.L.","Republic of Madagascar","Pending","Courts (Indian Ocean) Limited  (Mauritian), Courts Madagascar S.A.R.L. (Malagasy)","","December 23, 2013","BIT Madagascar - Mauritius 2004","",462
"78","ARB/13/36","Eiser Infrastructure Limited and Energía Solar Luxembourg S.à r.l.","Kingdom of Spain","Pending","EISER Infrastructure Limited  (British), Energia Solar Luxembourg S.à r.l. (Luxembourg)","","December 23, 2013","","ECT (Energy Charter Treaty)",461
"79","ARB/13/33","PNG Sustainable Development Program Ltd.","Independent State of Papua New Guinea","Concluded","PNG Sustainable Development Program Ltd. (Singaporean)","Award rendered by the Tribunal on May 5, 2015.","December 20, 2013","","Investment Law - Papua New Guinea",460
"80","ARB/13/32","MOL Hungarian Oil and Gas Company Plc","Republic of Croatia","Pending","MOL Hungarian Oil and Gas Company Plc (Hungarian)","","December 5, 2013","","ECT (Energy Charter Treaty)",459
"81","ARB/13/31","Antin Infrastructure Services Luxembourg S.à.r.l. and Antin Energia Termosolar B.V.","Kingdom of Spain","Pending","Antin Energia Termosolar B.V.  (Dutch), Antin Infrastructure Services Luxembourg S.à r.l. (Luxembourg)","","November 22, 2013","","ECT (Energy Charter Treaty)",458
"82","ARB/13/29","Cementos La Union S.A. and Aridos Jativa S.L.U","Arab Republic of Egypt","Pending","Aridos Jativa S.L.U. (Spanish), Cementos La Union S.A.  (Spanish)","","November 22, 2013","BIT Egypt,  Arab Republic of - Spain 1992","",457
"83","ARB/13/30","RREEF Infrastructure (G.P.) Limited and RREEF Pan-European Infrastructure Two Lux S.à r.l.","Kingdom of Spain","Pending","RREEF Infrastructure (G.P.) Limited (British), RREEF Pan-European Infrastructure Two Lux S.à r.l. (Luxembourg)","","November 22, 2013","","ECT (Energy Charter Treaty)",456
"84","ARB(AF)/13/2","Cemusa - Corporación Europea de Mobiliario Urbano, S.A. and Corporación Americana de Equipamientos Urbanos, S.L.","United Mexican States","Concluded","Cemusa - Corporación Europea de Mobiliario Urbano,  S.A.  (Spanish), Corporación Americana de Equipamientos Urbanos,  S.L. (Spanish)","The Acting Secretary-General issues a procedural order taking note of the discontinuance of the proceeding pursuant to Article 51 of the Arbitration (Additional Facility) Rules on August 18, 2014.","November 6, 2013","BIT Spain - Mexico 2006","",455
"85","UNCT/13/2","Spence International Investments et al.","Republic of Costa Rica","Pending","Spence International Investments et al.  (U.S.)","","October 17, 2013","","",454
"86","ARB/13/28","Transglobal Green Energy, LLC and Transglobal Green Panama, S.A.","Republic of Panama","Pending","Transglobal Green Energy,  LLC (U.S.), Transglobal Green Energy de Panama,  S.A. (Panamanian)","","October 10, 2013","BIT United States of America - Panama 1982","",453
"87","ARB/13/27","Marfin Investment Group Holdings S.A., Alexandros Bakatselos and others","Republic of Cyprus","Pending","Alexandros Bakatselos (Greek), Georgios Bakatselos (Greek), Nikolaos Bakatselos (Greek), Polytimi Bakatselos (Greek), Chevellas SA (Greek), Delfini Holdings SA (Greek), Lion Hellas SA (Greek), Marfin Investment Group Holdings SA  (Greek), Nikiforos Moschopoulos (Greek), Nik I Theocharakis SA (Greek), Matthaios Rigas (Greek), Teodomi SA (Greek), Anna-Maria Theocharaki (Greek), Despina Theocharaki (Greek), Marina Theocharaki (Greek), Nikolaos Theocharaki (Greek), Vasileios Theocharaki (Greek), Efstathios Topouzoglou (Greek), Andreas Vgenopoulos (Greek)","","September 27, 2013","BIT Cyprus - Greece 1992","",452
"88","ARB/13/26","Spentex Netherlands, B.V.","Republic of Uzbekistan","Pending","Spentex Netherlands,  B.V. (Dutch)","","September 27, 2013","BIT Netherlands - Uzbekistan 1996, ","Contract, Investment Law - Uzbekistan (1998)",451
"89","ARB/13/25","Tullow Uganda Operations Pty Ltd and Tullow Uganda Limited","Republic of Uganda","Concluded","Tullow Uganda Limited (British), Tullow Uganda Operations Pty Ltd  (Australian)","Order taking note of the discontinuance of the proceeding pursuant to ICSID Arbitration Rule 43(1) issued on July 15, 2015.","September 26, 2013","","Contract",450
"90","ARB/13/24","Republic of Peru","Caravelí Cotaruse Transmisora de Energía S.A.C.","Concluded","Republic of Peru (Peruvian)","The Secretary-General issues a procedural order taking note of the discontinuance of the proceeding pursuant to ICSID Arbitration Rule 43(1) on December 26, 2013.","September 19, 2013","","Contract",449
"91","ARB/13/23","ASA International S.p.A.","Arab Republic of Egypt","Pending","ASA International S.p.A. (Italian)","","September 13, 2013","BIT Egypt,  Arab Republic of - Italy 1989","",448
"92","UNCT/14/2","Eli Lilly and Company","Canada","Pending","Eli Lilly and Company  (U.S.)","","September 12, 2013","","NAFTA (North American Free Trade Agreement)",447
"93","ARB/13/22","Erbil Serter","French Republic","Pending","Erbil Serter (Turkish)","","September 10, 2013","BIT Turkey - France 2006","",446
"94","ARB/13/21","Edenred S.A.","Hungary","Pending","Edenred S.A. (French)","","September 9, 2013","BIT France - Hungary 1986","",445
"95","ARB/13/20","Interocean Oil Development Company and Interocean Oil Exploration Company","Federal Republic of Nigeria","Pending","Interocean Oil Development Company (U.S.), Interocean Oil Exploration Company (U.S.)","","September 9, 2013","","Investment Law - Nigeria (1995)",444
"96","UNCT/15/2","Lone Pine Resources Inc.","Canada","Pending","Lone Pine Resources Inc. (U.S.)","","September 6, 2013","","NAFTA (North American Free Trade Agreement)",443
"97","ARB/13/19","Günes Tekstil Konfeksiyon Sanayi ve Ticaret Limited Sirketi and others","Republic of Uzbekistan","Pending","Ibrahim Eksilmez (Turkish), Fikret Günes (Turkish), Resat Günes (Turkish), Vahit Günes (Turkish), Günes Tekstil Konfeksiyon Sanayi ve Ticaret Limited Sirketi (Turkish), Yücel Yildiz (Turkish)","","August 29, 2013","BIT Turkey - Uzbekistan 1992, ","Investment Law - Uzbekistan (1998)",442
"98","ARB/13/18","Enel Green Power S.p.A.","Republic of El Salvador","Pending","Enel Green Power S.p.A. (Italian)","","August 21, 2013","","Investment Law - El Salvador (1999)",441
"99","ARB/13/17","EVN AG","Republic of Bulgaria","Pending","EVN AG (Austrian)","","July 19, 2013","BIT Austria - Bulgaria 1997, ","ECT (Energy Charter Treaty)",440
"100","ARB/13/16","Société des Mines de Loulo S.A.","Republic of Mali","Pending","Société des Mines de Loulo S.A. (Malian)","","July 18, 2013","","Contract",439
"101","ARB/13/15","Lundin Tunisia B.V.","Republic of Tunisia","Concluded","Lundin Tunisia B.V. (Dutch)","The Secretary-General issues an order taking note of the discontinuance of the proceeding pursuant to Arbitration Rule 44 on September 9, 2014.","July 18, 2013","","Contract",438
"102","ARB/13/14","RSM Production Company","Republic of Cameroon","Pending","RSM Production Company (U.S.)","","July 1, 2013","","Contract",437
"103","ARB/13/13","Caratube International Oil Company LLP and Devincci Salah Hourani","Republic of Kazakhstan","Pending","Caratube International Oil Company LLP (Kazakhstani), Devincci Salah Hourani (U.S.)","","June 28, 2013","BIT United States of America - Kazakhstan 1992, ","Contract, Investment Law - Kazakhstan (1994)",436
"104","ARB/13/12","Lieven J. van Riet, Chantal C. van Riet and Christopher van Riet","Republic of Croatia","Pending","Chantal C. van Riet (Belgian), Christopher van Riet (Belgian), Lieven J. van Riet (Belgian)","","June 21, 2013","BIT Croatia - Belgium-Luxembourg 2001","",435
