"","Case No.","Claimant(s)","Respondent(s)","Status","claimants","outcome","registered","bit","instrument","claim_id"
"274","ARB/08/5","Burlington Resources, Inc.","Republic of Ecuador","Pending","Burlington Resources Andean Limited (British), Burlington Resources Ecuador Limited (British), Burlington Resources,  Inc. (U.S.), Burlington Resources Oriente Limited (British)","","June 2, 2008","BIT Ecuador - United States of America 1993, ","Contract",265
"275","ARB/08/4","Murphy Exploration and Production Company International","Republic of Ecuador","Concluded","Murphy Exploration and Production Company International (U.S.)","Award rendered on December 15, 2010; attached to the award is a dissenting opinion by one of the arbitrators. ","April 15, 2008","BIT Ecuador - United States of America 1993","",264
"276","ARB/08/3","Brandes Investment Partners, LP","Bolivarian Republic of Venezuela","Concluded","Brandes Investment Partners,  LP (U.S.)","Award rendered on August 2, 2011.","March 24, 2008","","Investment Law - Venezuela (1999)",263
"277","ARB(AF)/08/1","Quadrant Pacific Growth Fund L.P. and Canasco Holdings Inc.","Republic of Costa Rica","Concluded","Quadrant Pacific Growth Fund L.P.  (Canadian), Canasco Holdings Inc. (nationality not available)","The Tribunal issues an order taking note of the discontinuance of the proceeding pursuant to ICSID Administrative and Financial Regulation 14(3)(d) on October 27, 2010.","March 21, 2008","BIT Costa Rica - Canada 1998","",262
"278","ARB/08/2","ATA Construction, Industrial and Trading Company","Hashemite Kingdom of Jordan","Concluded","ATA Construction,  Industrial and Trading Company (Turkish)","Award rendered on May 18, 2010.","February 28, 2008","BIT Turkey - Jordan 1993","",261
"279","ARB/08/1","Marion Unglaube","Republic of Costa Rica","Concluded","Marion Unglaube (German)","Award rendered on May 16, 2012.","January 25, 2008","BIT Germany - Costa Rica 1994","",260
"280","ARB/07/32","Astaldi S.p.A.","Republic of Honduras","Concluded","Astaldi S.p.A. (Italian)","Award rendered on September 17, 2010.","December 19, 2007","","Contract",259
"281","ARB(AF)/07/4","Mobil Investments Canada Inc. and Murphy Oil Corporation","Canada","Concluded","Mobil Investments Canada Inc. (U.S.), Murphy Oil Corporation (U.S.)","Award rendered on February 20, 2015.","December 19, 2007","","NAFTA (North American Free Trade Agreement)",258
"282","ARB/07/31","HOCHTIEF Aktiengesellschaft","Argentine Republic","Pending","HOCHTIEF Aktiengesellschaft (German)","","December 18, 2007","BIT Germany - Argentina 1991","",257
"283","ARB/07/30","ConocoPhillips Petrozuata B.V., ConocoPhillips Hamaca B.V. and ConocoPhillips Gulf of Paria B.V.","Bolivarian Republic of Venezuela","Pending","ConocoPhillips Gulf of Paria B.V. (Dutch), ConocoPhillips Hamaca B.V. (Dutch), ConocoPhillips Petrozuata B.V. (Dutch)","","December 13, 2007","BIT Netherlands - Venezuela,  Republica Bolivariana de 1991, ","Investment Law - Venezuela (1999)",256
"284","ARB/07/29","SGS Société Générale de Surveillance S.A.","Republic of Paraguay","Concluded","SGS Société Générale de Surveillance S.A. (Swiss)","Award rendered on February 10, 2012.","November 19, 2007","BIT Switzerland - Paraguay 1992","",255
"285","ARB/07/28","E.T.I. Euro Telecom International N.V.","Plurinational State of Bolivia","Concluded","E.T.I. Euro Telecom International N.V. (Dutch)","Proceeding discontinued at the request of the Claimant (Order taking note of the discontinuance of the proceeding issued by the Tribunal pursuant to ICSID Arbitration Rule 44 on October 21, 2009).","October 31, 2007","BIT Bolivia - Netherlands 1992","",254
"286","ARB/07/27","Venezuela Holdings B.V. and others","Bolivarian Republic of Venezuela","Pending","Mobil Cerro Negro,  Ltd. (Bahamian), Mobil Cerro Negro Holding,  Ltd. (U.S.), Mobil Corporation (U.S.), Mobil Venezolana de Petróleos Holdings,  Inc. (U.S.), Mobil Venezolana de Petróleos,  Inc. (Bahamian), Venezuela Holdings,  B.V. (Dutch)","Award rendered on October 9, 2014. ","October 10, 2007","BIT Netherlands - Venezuela,  Republica Bolivariana de 1991, ","Investment Law - Venezuela (1999)",253
"287","ARB/07/26","Urbaser S.A. and Consorcio de Aguas Bilbao Bizkaia, Bilbao Biskaia Ur Partzuergoa","Argentine Republic","Pending","Consorcio de Aguas Bilbao Bizkaia,  Bilbao Biskaia Ur Partzuergoa (Spanish), Urbaser S.A.  (Spanish)","","October 1, 2007","BIT Spain - Argentina 1991","",252
"288","ARB/07/24","Gustav F W Hamester GmbH & Co KG","Republic of Ghana","Concluded","Gustav F W Hamester GmbH & Co KG (German)","Award rendered on June 18, 2010.","September 24, 2007","BIT Ghana - Germany 1995","",251
"289","ARB/07/25","Trans-Global Petroleum, Inc.","Hashemite Kingdom of Jordan","Concluded","Trans-Global Petroleum,  Inc. (U.S.)","Settlement agreed by the parties and settlement recorded at their request in the form of an award (Award embodying the parties' settlement agreement rendered on April 8, 2009, pursuant to ICSID Arbitration Rule 43(2)).","September 24, 2007","BIT Jordan - United States of America 1997","",250
"290","ARB/07/23","Railroad Development Corporation","Republic of Guatemala","Concluded","Railroad Development Corporation  (U.S.)","Award rendered on June 29, 2012. ","August 20, 2007","","CAFTA-DR (Dominican Republic-Central America Free Trade Agreement)",249
"291","ARB/07/22","AES Summit Generation Limited and AES-Tisza Erömü Kft.","Hungary","Concluded","AES Summit Generation Limited (British), AES-Tisza Erömü Kft. (Hungarian)","Award rendered on September 23, 2010.","August 13, 2007","","ECT (Energy Charter Treaty)",248
"292","ARB/07/19","Electrabel S.A.","Hungary","Pending","Electrabel S.A.  (Belgian)","","August 13, 2007","","ECT (Energy Charter Treaty)",247
"293","ARB/07/21","Pantechniki S.A. Contractors & Engineers","Republic of Albania","Concluded","Pantechniki S.A. Contractors & Engineers  (Greek)","Award rendered on July 30, 2009.","August 13, 2007","BIT Greece - Albania 1991, ","Investment Law - Albania (1993)",246
"294","ARB/07/20","Saba Fakes","Republic of Turkey","Concluded","Saba Fakes  (Dutch)","Award rendered on July 14, 2010.","August 13, 2007","BIT Netherlands - Turkey 1986","",245
"295","CONC/07/1","Shareholders of SESAM","Central African Republic","Concluded","Shareholders of SESAM: GITPON ENTERPRISE LTD.  (British), ARS LONGA (French)","Report of the Commission issued on  August 13, 2008.","August 13, 2007","","Contract",244
"296","ARB/07/18","Shell Nigeria Ultra Deep Limited","Federal Republic of Nigeria","Concluded","Shell Nigeria Ultra Deep Limited  (Nigerian)","The Tribunal issues an order taking note of the discontinuance of the proceeding pursuant to ICSID Arbitration Rule 43(1) on August 1, 2011.","July 26, 2007","BIT Netherlands - Nigeria 1992","",243
"297","ARB/07/16","Alpha Projektholding GmbH","Ukraine","Concluded","Alpha Projektholding GmbH  (Austrian)","Award rendered on November 8, 2010.","July 25, 2007","BIT Ukraine - Austria 1996","",242
"298","ARB/07/17","Impregilo S.p.A.","Argentine Republic","Concluded","Impregilo S.p.A.  (Italian)","Award rendered on June 21, 2011; attached to the award are two concurring and dissenting opinions by two members of the Tribunal.
","July 25, 2007","BIT Argentina - Italy 1990","",241
"299","ARB/07/14","Liman Caspian Oil BV and NCL Dutch Investment BV","Republic of Kazakhstan","Concluded","Liman Caspian Oil BV  (Dutch), NCL Dutch Investment BV (Dutch)","Award rendered on June 22, 2010.","July 16, 2007","","ECT (Energy Charter Treaty)",240
"300","ARB/07/15","Ron Fuchs","Georgia","Concluded","Ron Fuchs  (Israeli)","Award rendered on March 3, 2010.","July 16, 2007","BIT Georgia - Israel 1995","",239
"301","ARB/07/13","S&T Oil Equipment & Machinery Ltd.","Romania","Concluded","S&T Oil Equipment & Machinery Ltd.  (U.S.)","The Tribunal issues an order taking note of the discontinuance of the proceeding on July 16, 2010 for lack of payment of advances pursuant to Regulation 14(3)(d) of the ICSID Administrative and Financial Regulations.","July 16, 2007","BIT Romania - United States of America 1992","",238
"302","ARB/07/12","Toto Costruzioni Generali S.p.A.","Republic of Lebanon","Concluded","Toto Costruzioni Generali S.p.A.  (Italian)","The Tribunal renders its Award on June 7, 2012; attached to the Award is a Concurring Opinion of one of the Arbitrators.","July 3, 2007","BIT Lebanon - Italy 1997","",237
"303","ARB/07/11","ALAS International Baustoffproduktions AG","Bosnia and Herzegovina","Concluded","ALAS International Baustoffproduktions AG (Austrian)","Settlement agreed by the parties and proceeding discontinued at their request (Order taking note of the discontinuance issued by the Tribunal on December 27, 2007 pursuant to ICSID Arbitration Rule 43(1)).","May 9, 2007","BIT Bosnia and Herzegovina - Austria 2000","",236
"304","ARB/07/10","M. Meerapfel Söhne AG","Central African Republic","Concluded","M. Meerapfel Söhne AG (Swiss)","Award rendered on May 12, 2011.","April 25, 2007","","Contract",235
"305","ARB/07/9","Bureau Veritas, Inspection, Valuation, Assessment and Control, BIVAC B.V.","Republic of Paraguay","Concluded","Bureau Veritas,  Inspection,  Valuation,  Assessment and Control,  BIVAC B.V. (Dutch)","Order taking note of the discontinuance issued by the Tribunal on August 7, 2014 pursuant to Arbitration Rule 43(1).","April 11, 2007","BIT Netherlands - Paraguay 1992","",234
"306","ARB(AF)/07/3","Alasdair Ross Anderson and others","Republic of Costa Rica","Concluded","Alasdair Ross Anderson (Canadian), Jeannine Anderson (Canadian), Letty Anderson (Canadian), Jean-Claude Barbu (Canadian), Albert Barkhordarian (Canadian), Norman A. Barr (Canadian), Claude Beauchamp (Canadian), Warren Becker (Canadian), Michel Jean Bellefeuille (Canadian), Lance Llewellyn Ralph (Canadian), Bennett Lance (Canadian), Charles Bergeron (Canadian), Claudette Bernard (Canadian), Susan Frances Berrezueta (Canadian), Martin Eberhart Borner (Canadian), Tessa Osbourne Borner (Canadian), Andrew Leon Bowers (Canadian), Robert M. Browne (Canadian), Brian Roy Brownridge (Canadian), Andrew (Wynne) Burns (Canadian)","Award rendered on May 19, 2010.","March 27, 2007","BIT Costa Rica - Canada 1998","",233
"307","ARB/07/8","Giovanni Alemanni and others","Argentine Republic","Pending","Giovanni Alemanni  (Italian)","","March 27, 2007","BIT Argentina - Italy 1990","",232
"308","ARB(AF)/07/2","Europe Cement Investment and Trade S.A.","Republic of Turkey","Concluded","Europe Cement Investment and Trade S.A. (Polish)","Award rendered on August 13, 2009.","March 6, 2007","","ECT (Energy Charter Treaty)",231
"309","ARB/07/7","Global Gold Mining LLC","Republic of Armenia","Concluded","Global Gold Mining,  LLC  (U.S.)","Settlement agreed by the parties and proceeding discontinued at their request (Order taking note of the discontinuance issued by the Acting Secretary-General on May 9, 2008 pursuant to ICSID Arbitration Rule 43(1)).","February 20, 2007","BIT United States of America - Armenia 1992","",230
"310","ARB/07/6","Tza Yap Shum","Republic of Peru","Concluded","Tza Yap Shum  (Chinese)","Award rendered on July 7, 2011.","February 12, 2007","BIT Peru - China 1994","",229
"311","ARB/07/5","Abaclat and others","Argentine Republic","Pending","Abaclat and others  (nationality not available)","","February 7, 2007","BIT Argentina - Italy 1990","",228
"312","ARB/07/4","Eni Dación B.V.","Bolivarian Republic of Venezuela","Concluded","Eni Dación B.V.  (Dutch)","Settlement agreed by the parties and proceeding discontinued at the request of the Claimant (Order taking note of the discontinuance issued by the Acting Secretary-General pursuant to ICSID Arbitration Rule 44 on April 18, 2008).","February 6, 2007","BIT Netherlands - Venezuela,  Republica Bolivariana de 1991, ","Investment Law - Venezuela (1999)",227
"313","ARB/07/3","Government of the Province of East Kalimantan","PT Kaltim Prima Coal and others","Concluded","Government of the Province of East Kalimantan (Indonesian),  (nationality not available),  (nationality not available),  (nationality not available),  (nationality not available),  (nationality not available),  (nationality not available)","Award rendered on December 28, 2009.","January 18, 2007","","Contract",226
"314","ARB/07/2","RSM Production Corporation","Central African Republic","Concluded","RSM Production Corporation  (U.S.)","Award rendered on July 11, 2011.","January 18, 2007","","Contract",225
"315","ARB/07/1","Fondel Metal Participations B.V.","Republic of Azerbaijan","Concluded","Fondel Metal Participations B.V.  (Dutch)","Settlement agreed by the parties and proceeding discontinued at their request (Order taking note of the discontinuance issued by the Tribunal on January 23, 2009 pursuant to Arbitration Rule 43(1)). ","January 9, 2007","","Contract",224
"316","ARB(AF)/07/1","Piero Foresti, Laura de Carli and others","Republic of South Africa","Concluded","Daniela Contri (Italian), Franca Contri (Italian), Ida Laura de Carli (Italian), Finstone s.à.r.l. (Luxembourg), Dora Foresti (Italian), Piero Foresti (Italian), Maria Teresa Suardo (Italian), Paola Suardo (Italian)","The Tribunal renders its award on August 4, 2010. Attached to the award is a concurring opinion by one of the arbitrators.","January 8, 2007","BIT Belgium-Luxembourg - South Africa 1998","",223
"317","ARB/06/21","City Oriente Limited","Republic of Ecuador and Empresa Estatal Petróleos del Ecuador (Petroecuador)","Concluded","City Oriente Limited (Panamanian)","Settlement agreed by the parties and proceeding discontinued at their request (Order taking note of the discontinuance issued by the Tribunal on September 12, 2008 pursuant to ICSID Arbitration Rule 43(1)).","December 19, 2006","","Contract",222
"318","ARB/06/20","Newmont USA Limited and Newmont (Uzbekistan) Limited","Republic of Uzbekistan","Concluded","Newmont USA Limited (U.S.), Newmont (Uzbekistan) Limited (Cypriot)","Settlement agreed by the parties and proceeding discontinued at their request (Order taking note of the discontinuance issued by the Tribunal on July 25, 2007 pursuant to Arbitration Rule 43(1)).","December 12, 2006","","Investment Law - Uzbekistan (1998)",221
"319","ARB/06/19","Nations Energy, Inc. and others","Republic of Panama","Concluded","Electric Machinery Enterprises Inc. (U.S.), Jaime Jurado (U.S.), Nations Energy,  Inc. (U.S.)","Award rendered on November 24, 2010; attached to the award is a dissenting opinion by one of the arbitrators.","December 11, 2006","BIT United States of America - Panama 1982","",220
"320","ARB/06/18","Joseph C. Lemire","Ukraine","Concluded","Joseph C. Lemire  (U.S.)","Award rendered on March 28, 2011; attached to the Award is a Dissenting Opinion by one of the arbitrators.","December 8, 2006","BIT Ukraine - United States of America 1994, ","Contract",219
"321","ARB(AF)/06/2","Cementownia ""Nowa Huta"" S.A.","Republic of Turkey","Concluded","Cementownia ""Nowa Huta"" S.A. (Polish)","Award rendered on September 17, 2009.","November 16, 2006","","ECT (Energy Charter Treaty)",218
"322","ARB/06/17","Técnicas Reunidas, S.A. and Eurocontrol, S.A.","Republic of Ecuador","Concluded","Eurocontrol,  S.A.  (Spanish), Técnicas Reunidas,  S.A. (Spanish)","Proceeding discontinued at the request of the Claimants (Order taking note of the discontinuance issued by the Acting Secretary-General on May 13, 2008, pursuant to ICSID Arbitration Rule 44).","October 31, 2006","BIT Ecuador - Spain 1996","",217
"323","ARB/06/16","Barmek Holding A.S.","Republic of Azerbaijan","Concluded","Barmek Holding A.S. (Turkish)","Settlement agreed by the parties and settlement recorded at their request in the form of an award (Award embodying the parties' settlement agreement rendered on September 28, 2009, pursuant to ICSID Arbitration Rule 43(2)).","October 16, 2006","BIT Turkey - Azerbaijan 1994, ","Contract",216
"324","ARB/06/15","Azpetrol International Holdings B.V., Azpetrol Group B.V. and Azpetrol Oil Services Group B.V.","Republic of Azerbaijan","Concluded","Azpetrol Group B.V. (Dutch), Azpetrol International Holdings B.V. (Dutch), Azpetrol Oil Services Group B.V. (Dutch)","Award rendered on September 8, 2009.","August 30, 2006","","ECT (Energy Charter Treaty)",215
"325","ARB/06/14","Shell Brands International AG and Shell Nicaragua S.A.","Republic of Nicaragua","Concluded","Shell Brands International AG (Swiss), Shell Nicaragua S.A. (Nicaraguan)","Settlement agreed by the parties and proceeding discontinued at the request of the Claimants (Order taking note of the discontinuance issued by the Secretary-General pursuant to ICSID Arbitration Rule 44 on March 12, 2007).","August 11, 2006","BIT Netherlands - Nicaragua 2000","",214
"326","ARB/06/13","Aguaytia Energy, LLC","Republic of Peru","Concluded","Aguaytia Energy,  LLC  (U.S.)","Award rendered on December 11, 2008.","July 17, 2006","","Contract",213
"327","ARB/06/12","Scancem International ANS","Republic of Congo","Concluded","Scancem International ANS  (Norwegian)","Settlement agreed by the parties and proceeding discontinued at the request of the Claimant (Order taking note of the discontinuance issued by the Acting Secretary-General on July 10, 2008 pursuant to ICSID Arbitration Rule 44).","July 17, 2006","","Contract",212
"328","ARB/06/11","Occidental Petroleum Corporation and Occidental Exploration and Production Company","Republic of Ecuador","Pending","Occidental Exploration and Production Company  (U.S.), Occidental Petroleum Corporation (U.S.)","Award rendered on October 5, 2012; attached to the award is a dissenting opinion by one of the arbitrators. ","July 13, 2006","BIT Ecuador - United States of America 1993, ","Contract",211
"329","ARB/06/10","Chevron Bangladesh Block Twelve, Ltd. and Chevron Bangladesh Blocks Thirteen and Fourteen, Ltd.","People's Republic of Bangladesh","Concluded","Chevron Bangladesh Block Twelve,  Ltd. (British), Chevron Bangladesh Blocks Thirteen and Fourteen,  Ltd. (British)","Award rendered on May 17, 2010","June 30, 2006","","Contract",210
"330","ARB/06/9","Branimir Mensik","Slovak Republic","Concluded","Branimir Mensik  (Swiss)","The Tribunal issues an order for the discontinuance of the proceeding on December 9, 2008, for lack of payment of advances, pursuant to Regulation 14(3)(d) of the ICSID Administrative and Financial Regulations.","May 10, 2006","BIT Switzerland - Czech Republic 1990","",209
"331","ARB/06/8","Libananco Holdings Co. Limited","Republic of Turkey","Concluded","Libananco Holdings Co. Limited (Cypriot)","Award rendered on September 2, 2011.","April 19, 2006","","ECT (Energy Charter Treaty)",208
"332","ARB(AF)/06/1","Sistem Muhendislik Insaat Sanayi ve Ticaret A.S.","Kyrgyz Republic","Concluded","Sistem Muhendislik Insaat Sanayi ve Ticaret A.S.  (Turkish)","Award rendered on September 9, 2009 ","April 12, 2006","BIT Kyrgyz Republic - Turkey 1992, ","Investment Law - Kyrgyz Republic (2003)",207
"333","ARB/06/7","Togo Electricité and GDF-Suez Energie Services","Republic of Togo","Concluded","GDF-Suez Energie Services (French), Togo Electricité (Togolese)","The Tribunal renders its award on August 10, 2010.","April 10, 2006","","Contract",206
"334","ARB/06/6","Rail World LLC and others","Republic of Estonia","Concluded","EEIF Rail BV (Dutch), Railroad Development Corporation (U.S.), Rail World Estonia LLC (U.S.)","Settlement agreed by the parties and proceeding discontinued at their request (Order taking note of the discontinuance issued by the Tribunal on February 5, 2007 pursuant to Arbitration Rule 43(1)).","April 5, 2006","BIT Netherlands - Estonia 1992, BIT United States of America - Estonia 1994","",205
"335","ARB/06/5","Phoenix Action Ltd","Czech Republic","Concluded","Phoenix Action Ltd. (Israeli)","Award rendered on April 15, 2009.","March 23, 2006","BIT Israel - Czech Republic 1997","",204
"336","ARB/06/4","Vestey Group Ltd","Bolivarian Republic of Venezuela","Pending","Vestey Group Ltd  (British)","","March 14, 2006","BIT Venezuela,  Republica Bolivariana de - United Kingdom of Great Britain and Northern Ireland 1995, ","Investment Law - Venezuela (1999)",203
"337","ARB/06/3","The Rompetrol Group N.V.","Romania","Concluded","The Rompetrol Group N.V.  (Dutch)","Award rendered on May 6, 2013.","February 14, 2006","BIT Romania - Netherlands 1994","",202
"338","ARB/06/2","Quiborax S.A. and Non-Metallic Minerals S.A.","Plurinational State of Bolivia","Pending","Allan Fosk (Chilean), Non-Metallic Minerals S.A. (Bolivian), Quiborax S.A. (Chilean)","","February 6, 2006","BIT Bolivia - Chile 1994","",201
"339","ARB/06/1","Spyridon Roussalis","Romania","Concluded","Spyridon Roussalis  (Greek)","The Tribunal renders its award on December 7, 2011; attached to the award is a separate opinion by arbitrator W. Michael Reisman.","January 10, 2006","BIT Greece - Romania 1997","",200
"340","ARB/05/24","Hrvatska Elektroprivreda d.d.","Republic of Slovenia","Pending","Hrvatska Elektroprivreda d.d.  (Croatian)","","December 28, 2005","","ECT (Energy Charter Treaty)",199
"341","ARB/05/23","Ares International S.r.l. and MetalGeo S.r.l.","Georgia","Concluded","Ares International S.r.l. (Italian), MetalGeo S.r.l. (Italian)","Award rendered on February 28, 2008.","November 9, 2005","BIT Georgia - Italy 1997","",198
"342","ARB/05/22","Biwater Gauff (Tanzania) Limited","United Republic of Tanzania","Concluded","Biwater Gauff (Tanzania) Limited (British)","Award rendered on July 24, 2008; attached to the award is a concurring and dissenting opinion by one of the arbitrators.","November 2, 2005","BIT United Kingdom of Great Britain and Northern Ireland - Tanzania 1994, ","Investment Law - TANZANIA (1997)",197
"343","ARB/05/21","African Holding Company of America, Inc. and Société Africaine de Construction au Congo S.A.R.L.","Democratic Republic of the Congo","Concluded","African Holding Company of America,  Inc. (U.S.),  Société Africaine de Construction au Congo S.A.R.L. (Congolese (D.R.))","Award rendered on July 29, 2008; attached to the award is a dissenting opinion by one of the arbitrators.","October 27, 2005","BIT Zaire - United States of America 1984","",196
"344","ARB/05/20","Ioan Micula, Viorel Micula and others","Romania","Pending","Ioan Micula (Swedish), S.C. European Food S.A. (Romanian), S.C. Multipack S.R.L. (Romanian), S.C. Starmill S.R.L. (Romanian), Viorel Micula (Swedish)","The Tribunal renders its award on December 11, 2013; attached to the award is a separate opinion by arbitrator Georges Abi-Saab.","October 13, 2005","BIT Sweden - Romania 2002","",195
"345","ARB/05/19","Helnan International Hotels A/S","Arab Republic of Egypt","Concluded","Helnan International Hotels A/S  (Danish)","Award rendered on July 3, 2008.","October 5, 2005","BIT Denmark - Egypt,  Arab Republic of 1999","",194
"346","ARB/05/18","Ioannis Kardassopoulos","Georgia","Concluded","Ioannis Kardassopoulos  (Greek)","Award rendered on March 3, 2010.","October 3, 2005","BIT Greece - Georgia 1994, ","ECT (Energy Charter Treaty)",193
"347","ARB/05/17","Desert Line Projects LLC","Republic of Yemen","Concluded","Desert Line Projects LLC  (Omani)","Award rendered on February 6, 2008.","September 30, 2005","BIT Oman - Yemen,  Republic of 1998","",192
"348","ARB(AF)/05/2","Cargill, Incorporated","United Mexican States","Concluded","Cargill,  Incorporated  (U.S.)","Award rendered on September 18, 2009.","August 30, 2005","","NAFTA (North American Free Trade Agreement)",191
"349","ARB/05/16","Rumeli Telekom A.S. and Telsim Mobil Telekomunikasyon Hizmetleri A.S.","Republic of Kazakhstan","Concluded","Rumeli Telekom A.S. (Turkish), Telsim Mobil Telekomunikasyon Hizmetleri A.S.  (Turkish)","Award rendered on July 29, 2008.","August 30, 2005","BIT Turkey - Kazakhstan 1992, ","Investment Law - Kazakhstan (1994)",190
"350","ARB/05/14","RSM Production Corporation","Grenada","Concluded","RSM Production Corporation  (U.S.)","Award rendered on March 13, 2009.","August 5, 2005","","Contract",189
"351","ARB/05/15","Waguih Elie George Siag and Clorinda Vecchi","Arab Republic of Egypt","Concluded","Clorinda Vecchi  (Italian), Waguih Elie George Siag (Italian)","Award rendered on June 1, 2009; attached to the award is a dissenting opinion by one of the arbitrators.","August 5, 2005","BIT Egypt,  Arab Republic of - Italy 1989","",188
"352","ARB/05/13","EDF (Services) Limited","Romania","Concluded","EDF (Services) Limited  (British)","Award rendered on October 8, 2009; attached to the Award is a Dissenting Opinion by one of the arbitrators.","July 29, 2005","BIT United Kingdom of Great Britain and Northern Ireland - Romania 1995","",187
"353","ARB/05/12","Noble Energy Inc. and MachalaPower Cía. Ltd.","Republic of Ecuador and Consejo Nacional de Electricidad","Concluded","MachalaPower Cía. Ltd. (British), Noble Energy Inc. (British)","Settlement agreed by the parties and proceeding discontinued at their request (Order taking note of the discontinuance issued by the Tribunal on May 20, 2009 pursuant to Arbitration Rule 43(1). ","July 29, 2005","BIT Ecuador - United States of America 1993, ","Contract",186
