"","Case No.","Claimant(s)","Respondent(s)","Status","claimants","outcome","registered","bit","instrument","claim_id"
"193","ARB/11/10","The Williams Companies, International Holdings B.V., WilPro Energy Services (El Furrial) Limited and WilPro Energy Services (Pigap II) Limited","Bolivarian Republic of Venezuela","Pending","The Williams Companies,  International Holdings B.V. (Dutch), WilPro Energy Services (El Furrial) Limited (British), WilPro Energy Services (Pigap II) Limited (British)","","April 20, 2011","BIT Netherlands - Venezuela,  Republica Bolivariana de 1991","",346
"194","ARB/11/9","Caravelí Cotaruse Transmisora de Energía S.A.C.","Republic of Peru","Concluded","Caravelí Cotaruse Transmisora de Energía S.A.C. (Peruvian)","Award rendered on April 15, 2013.","April 15, 2011","","Contract",345
"195","UNCT/13/1","The Renco Group, Inc.","Republic of Peru","Pending","The Renco Group,  Inc. (U.S.)","","April 4, 2011","","FTA Peru – United States of America 2006",344
"196","ARB/11/8","Agility for Public Warehousing Company K.S.C.","Islamic Republic of Pakistan","Pending","Agility for Public Warehousing Company K.S.C. (Kuwaiti)","","March 28, 2011","BIT Kuwait - Pakistan 1983","",343
"197","ARB/11/7","National Gas S.A.E.","Arab Republic of Egypt","Concluded","National Gas S.A.E. (Egyptian)","Award rendered on April 3, 2014.","March 22, 2011","BIT Egypt,  Arab Republic of - United Arab Emirates 1997","",342
"198","ARB/11/6","Bawabet Al Kuwait Holding Company","Arab Republic of Egypt","Pending","Bawabet Al Kuwait Holding Company  (Kuwaiti)","","March 18, 2011","BIT Egypt,  Arab Republic of - Kuwait 2001","",341
"199","ARB(AF)/11/2","Crystallex International Corporation","Bolivarian Republic of Venezuela","Pending","Crystallex International Corporation (Canadian)","","March 9, 2011","BIT Canada - Venezuela,  Republica Bolivariana de 1996","",340
"200","ARB/11/5","Longreef Investments A.V.V.","Bolivarian Republic of Venezuela","Pending","Longreef Investments A.V.V. (Dutch)","","February 23, 2011","BIT Netherlands - Venezuela,  Republica Bolivariana de 1991","",339
"201","ARB(AF)/11/1","Nova Scotia Power Incorporated","Bolivarian Republic of Venezuela","Concluded","Nova Scotia Power Incorporated (Canadian)","Award rendered on April 30, 2014.","January 26, 2011","BIT Canada - Venezuela,  Republica Bolivariana de 1996","",338
"202","ARB/11/4","Club Hotel Loutraki S.A. and Casinos Austria International Holding GMBH","Republic of Serbia","Concluded","Casinos Austria International Holding GmbH (Austrian), Club Hotel Loutraki S.A. (Greek)","The Tribunal issues a procedural order taking note of the discontinuance of the proceeding pursuant to ICSID Arbitration Rule 44 on January 18, 2012.","January 21, 2011","BIT Greece - Serbia 1997, BIT Serbia - Austria 2001","",337
"203","ARB/11/3","Accession Eastern Europe Capital AB and Mezzanine Management Sweden AB","Republic of Bulgaria","Concluded","Accession Eastern Europe Capital AB (Swedish), Mezzanine Management Sweden AB (Swedish)","The Secretary-General issues a procedural order taking note of the discontinuance of the proceeding pursuant to ICSID Arbitration Rule 45 on July 23, 2012. ","January 20, 2011","BIT Sweden - Bulgaria 1994","",336
"204","ARB/11/2","Türkiye Petrolleri Anonim Ortakligi","Republic of Kazakhstan","Concluded","
Türkiye Petrolleri Anonim Ortakligi (Turkish)","Award is rendered on August 18, 2014.","January 14, 2011","BIT Turkey - Kazakhstan 1992, ","ECT (Energy Charter Treaty)",335
"205","ARB/11/1","Highbury International AVV and Ramstein Trading Inc.","Bolivarian Republic of Venezuela","Pending","Highbury International AVV (Dutch), Ramstein Trading Inc. (Panamanian)","Award rendered on September 26, 2013","January 5, 2011","BIT Netherlands - Venezuela,  Republica Bolivariana de 1991, ","Investment Law - Venezuela (1999)",334
"206","ARB/10/25","Border Timbers Limited, Timber Products International (Private) Limited, and Hangani Development Co. (Private) Limited","Republic of Zimbabwe","Concluded","Border Timbers International (Private) Limited (Zimbabwean), Border Timbers Limited (Zimbabwean), Hangani Development Co. (Private) Limited (Zimbabwean)","Award rendered by the Tribunal on July 28, 2015.","December 20, 2010","BIT Zimbabwe - Switzerland 1996","",333
"207","ARB/10/24","Içkale Insaat Limited Sirketi","Turkmenistan","Pending","Içkale Insaat Limited Sirketi  (Turkish)","","December 20, 2010","BIT Turkmenistan - Turkey 1992","",332
"208","ARB/10/23","TECO Guatemala Holdings, LLC","Republic of Guatemala","Pending","TECO Guatemala Holdings,  LLC (U.S.)","Award rendered on December 19, 2013.","November 23, 2010","","CAFTA-DR (Dominican Republic-Central America Free Trade Agreement)",331
"209","ARB/10/22","Ömer Dede and Serdar Elhüseyni","Romania","Concluded","Ömer Dede (Turkish), Serdar Elhüseyni (Turkish)","Award rendered on September 5, 2013.","November 19, 2010","BIT Turkey - Romania 1991","",330
"210","ARB/10/21","International Quantum Resources Limited, Frontier SPRL and Compagnie Minière de Sakania SPRL","Democratic Republic of the Congo","Concluded","Compagnie Minière de Sakania SPRL (Congolese (D.R.)), Frontier SPRL (Congolese (D.R.)), International Quantum Resources Limited (British)","The Tribunal issues a procedural order taking note of the discontinuance of the proceeding pursuant to ICSID Arbitration Rule 43(1) on April 12, 2012.","October 22, 2010","","Other",329
"211","ARB/10/20","Standard Chartered Bank (Hong Kong) Limited","Tanzania Electric Supply Company Limited","Pending","Standard Chartered Bank (Hong Kong) Limited (Chinese)","","October 1, 2010","","Contract",328
"212","ARB(AF)/10/1","David Minnotte and Robert Lewis","Republic of Poland","Concluded","David Minnotte (U.S.), Robert Lewis (U.S.)","Award rendered on May 16, 2014.","September 14, 2010","BIT United States of America - Poland 1990","",327
"213","ARB/10/19","Flughafen Zürich A.G. and Gestión e Ingenería IDC S.A.","Bolivarian Republic of Venezuela","Pending","Flughafen Zürich A.G. (Swiss), Gestión e Ingenería IDC S.A. (Chilean)","Award rendered on November 18, 2014; attached to the award is a partial dissenting opinion by arbitrator Raúl Emilio Vinuesa.","August 9, 2010","BIT Venezuela,  Republica Bolivariana de - Switzerland 1993, BIT Venezuela,  Republica Bolivariana de - Chile 1993","",326
"214","ARB/10/18","Niko Resources (Bangladesh) Ltd.","Bangladesh Petroleum Exploration and Production Company Limited (""Bapex"") and Bangladesh Oil Gas and Mineral Corporation (""Petrobangla"")","Pending","Niko Resources (Bangladesh) Ltd. (Barbadian)","","July 28, 2010","","Contract",325
"215","ARB/10/16","AES Corporation and Tau Power B.V.","Republic of Kazakhstan","Concluded","AES Corporation (U.S.), Tau Power B.V. (Dutch)","Award rendered on November 1, 2013.","July 20, 2010","BIT United States of America - Kazakhstan 1992, ","ECT (Energy Charter Treaty), Investment Law - Kazakhstan (1994)",324
"216","ARB/10/17","Renée Rose Levy de Levi","Republic of Peru","Concluded","Renée Rose Levy de Levi (French)","Award rendered on February 26, 2014; attached to the award is a dissenting opinion by arbitrator Joaquín Morales Godoy.","July 20, 2010","BIT France - Peru 1993","",323
"217","ARB/10/15","Bernhard von Pezold and others","Republic of Zimbabwe","Concluded","Maria Juliane Andrea Christiane Katharina Batthyàny (Swiss, German), Felix Alard Moritz Hermannn Kilian von Pezold (Swiss, German), Heinrich Bernd Alexander Josef von Pezold (Swiss, German), Johann Friedrich Georg Ludwig von Pezold (Swiss, German), Bernhard Friedrich Arnd Rüdiger von Pezold (German), Elisabeth Regina Maria Gabriele von Pezold (Swiss, German), Anna Eleonore Elisabeth Webber (Swiss, German), Adam Friedrich Carl Leopold Franz Severin von Pezold (Swiss, German)","Award rendered by the Tribunal on July 28, 2015.","July 8, 2010","BIT Zimbabwe - Switzerland 1996, BIT Zimbabwe - Germany 1995","",322
"218","ARB/10/13","Hassan Awdi, Enterprise Business Consultants, Inc. and Alfa El Corporation","Romania","Concluded","Alfa El Corporation (U.S.), Hassan Awdi (U.S.), Enterprise Business Consultants,  Inc. (U.S.)","Award rendered by the Tribunal on March 2, 2015.","June 16, 2010","BIT Romania - United States of America 1992","",321
"219","ARB/10/14","Opic Karimum Corporation","Bolivarian Republic of Venezuela","Concluded","Opic Karimum Corporation (Panamanian)","Award rendered on May 28, 2013; attached to the award is a dissenting opinion by arbitrator Guido Santiago Tawil. ","June 16, 2010","","Investment Law - Venezuela (1999)",320
"220","ARB/10/12","Standard Chartered Bank","United Republic of Tanzania","Pending","Standard Chartered Bank (British)","Award rendered on November 2, 2012.","June 11, 2010","BIT United Kingdom of Great Britain and Northern Ireland - Tanzania 1994","",319
"221","ARB/10/11","Niko Resources (Bangladesh) Ltd.","Bangladesh Petroleum Exploration & Production Company Limited (""Bapex"") and Bangladesh Oil Gas and Mineral Corporation","Pending","Niko Resources (Bangladesh) Ltd. (Barbadian)","","May 27, 2010","","Contract",318
"222","ARB/10/10","Olyana Holdings LLC","Republic of Rwanda","Concluded","Olyana Holdings LLC  (U.S.)","The Tribunal issues an order taking note of the discontinuance of the proceeding pursuant to ICSID Arbitration Rule 43(1) on January 7, 2011.","April 16, 2010","","Contract",317
"223","ARB/10/8","Pan American Energy LLC","Plurinational State of Bolivia","Concluded","Pan American Energy LLC (U.S.)","Order taking note of the discontinuance of the proceeding issued by the Tribunal pursuant to ICSID Arbitration Rule 43(1) on February 24, 2015.","April 12, 2010","BIT Bolivia - United States of America 1998","",316
"224","ARB/10/9","Universal Compression International Holdings, S.L.U.","Bolivarian Republic of Venezuela","Pending","Universal Compression International Holdings,  S.L.U. (Spanish)","","April 12, 2010","BIT Spain - Venezuela,  Republica Bolivariana de 1995","",315
"225","ARB/10/7","Philip Morris Brand Sàrl (Switzerland), Philip Morris Products S.A. (Switzerland) and Abal Hermanos S.A. (Uruguay)","Oriental Republic of Uruguay","Pending","Abal Hermanos S.A. (Uruguay) (Uruguayan), FTR Holding S.A. (Swiss), Philip Morris Brand Sàrl (Switzerland) (Swiss), Philip Morris Products S.A. (Switzerland) (Swiss)","","March 26, 2010","BIT Uruguay - Switzerland 1988","",314
"226","ARB/10/6","RSM Production Corporation and others","Grenada","Concluded","Miriam Z. Grynberg (U.S.), Rachel S. Grynberg (U.S.), Stephen M. Grynberg (U.S.), RSM Production Corporation (U.S.)","Award rendered on December 10, 2010.","March 16, 2010","BIT United States of America - Grenada 1986","",313
"227","ARB/10/5","Tidewater Investment SRL and Tidewater Caribe, C.A.","Bolivarian Republic of Venezuela","Pending","Jackson Marine,  L.L.C. (U.S.), Point Marine,  L.L.C. (U.S.), Tidewater Caribe,  C.A. (Venezuelan), Tidewater Inc. (U.S.), Tidewater Investment SRL (Barbadian), Twenty Grand Marine Service,  L.L.C. (U.S.), Twenty Grand Offshore,  L.L.C. (U.S.), Zapata Gulf Marine Operations,  L.L.C. (U.S.)","Award rendered on March 13, 2015.","March 5, 2010","BIT Venezuela,  Republica Bolivariana de - Barbados 1994, ","Investment Law - Venezuela (1999)",312
"228","ARB/10/4","Antoine Abou Lahoud and Leila Bounafeh-Abou Lahoud","Democratic Republic of the Congo","Pending","Antoine Abou Lahoud (Lebanese), Leila Bounafeh-Abou Lahoud (Lebanese)","Award rendered on February 7, 2014.","March 4, 2010","","Investment Law - Congo (2002)",311
"229","UNCT/10/1","AbitibiBowater Inc.","Canada","Concluded","AbitibiBowater Inc. (U.S.)","Award rendered on December 15, 2010.","February 25, 2010","","NAFTA (North American Free Trade Agreement)",310
"230","ARB/10/3","Metal-Tech Ltd.","Republic of Uzbekistan","Concluded","Metal-Tech Ltd. (Israeli)","Award rendered on October 4, 2013.","February 4, 2010","BIT Israel - Uzbekistan 1994","",309
"231","ARB/10/2","Convial Callao S.A. and CCI - Compañía de Concesiones de Infraestructura S.A.","Republic of Peru","Concluded","CCI - Compañía de Concesiones de Infraestructura S.A. (Argentine), Convial Callao S.A.  (Peruvian)","Award rendered on May 21, 2013.","February 2, 2010","BIT Peru - Argentina 1994","",308
"232","ARB/10/1","Kiliç Insaat Ithalat Ihracat Sanayi ve Ticaret Anonim Sirketi","Turkmenistan","Concluded","Kiliç Insaat Ithalat Ihracat Sanayi ve Ticaret Anonim Sirketi  (Turkish)","Award rendered on July 2, 2013.","January 19, 2010","BIT Turkmenistan - Turkey 1992","",307
"233","ARB/09/23","Corporación Quiport S.A. and others","Republic of Ecuador","Concluded","ADC Management Ltd. (British), Aecon Investment Corp. (Barbadian), AG Concessions Inc. (British), Black Coral Investments Inc. (British), Corporación Quiport S.A. (Ecuadoran), Icaros Development Corporation S.A. (Uruguayan), Quiport Holdings S.A. (Uruguayan)","The Secretary-General issues an order taking note of the discontinuance of the proceeding pursuant to Arbitration Rule 43(1) on November 11, 2011.","December 30, 2009","","Contract",306
"234","ARB/09/22","Itera International Energy LLC and Itera Group NV","Georgia","Concluded","Itera Group NV (Dutch), Itera International Energy LLC  (U.S.)","The Secretary-General issues an order taking note of the discontinuance of the proceeding pursuant to Arbitration Rule 43(1) on November 19, 2010","December 29, 2009","BIT United States of America - Georgia 1994, BIT Georgia - Netherlands 1998","",305
"235","ARB/09/21","UAB ""ARVI"" ir ko and UAB ""SANITEX""","Republic of Serbia","Concluded","UAB ""ARVI"" ir ko (Lithuanian), UAB ""SANITEX"" (Lithuanian)","Award rendered by the Tribunal on March 16, 2015; attached to the award is a separate opinion by arbitrator Charles N. Brower.","December 18, 2009","BIT Lithuania - Montenegro 2005, BIT Serbia - Lithuania 2005","",304
"236","ARB(AF)/09/2","Abengoa, S.A. y COFIDES, S.A.","United Mexican States","Concluded","Abengoa,  S.A. (Spanish), COFIDES,  S.A. (Spanish)","Award rendered on April 18, 2013.","December 11, 2009","BIT Spain - Mexico 2006","",303
"237","ARB/09/20","Reinhard Hans Unglaube","Republic of Costa Rica","Concluded"," Reinhard Hans Unglaube (German)","Award rendered on May 16, 2012.","November 11, 2009","BIT Germany - Costa Rica 1994","",302
"238","ARB(AF)/09/1","Gold Reserve Inc.","Bolivarian Republic of Venezuela","Concluded","Gold Reserve Inc. (Canadian)","Award rendered on September 22, 2014.","November 9, 2009","BIT Canada - Venezuela,  Republica Bolivariana de 1996","",301
"239","ARB/09/19","Carnegie Minerals (Gambia) Limited","Republic of The Gambia","Concluded","Carnegie Minerals (Gambia) Limited (Gambian)","Award rendered by the Tribunal on July 14, 2015.","October 23, 2009","","Contract",300
"240","ARB/09/18","Cambodia Power Company","Kingdom of Cambodia","Concluded","Cambodia Power Company (Cambodian)","Award rendered on April 22, 2013.","September 16, 2009","","Contract",299
"241","ARB/09/17","Commerce Group Corp. and San Sebastian Gold Mines, Inc.","Republic of El Salvador","Concluded","Commerce Group Corp. (U.S.), San Sebastian Gold Mines,  Inc. (U.S.)","Award rendered on March 14, 2011.","August 21, 2009","","CAFTA-DR (Dominican Republic-Central America Free Trade Agreement), Investment Law - El Salvador (1999)",298
"242","ARB/09/16","Swisslion DOO Skopje","Macedonia, former Yugoslav Republic of","Concluded","Swisslion DOO Skopje (Macedonian)","Award rendered on July 6, 2012.","August 21, 2009","BIT Macedonia,  Former Yugoslav Republic of - Serbia 1996, BIT Switzerland - Macedonia,  Former Yugoslav Republic of 1996","",297
"243","ARB/09/15","H&H Enterprises Investments, Inc.","Arab Republic of Egypt","Pending","H&H Enterprises Investments,  Inc. (U.S.)","Award rendered on May 6, 2014.","August 11, 2009","BIT Egypt,  Arab Republic of - United States of America 1986","",296
"244","ARB/09/14","Mærsk Olie, Algeriet A/S","People's Democratic Republic of Algeria","Concluded","Mærsk Olie,  Algeriet A/S (Danish)","The Tribunal issues a procedural order taking note of the discontinuance of the proceeding pursuant to ICSID Arbitration Rule 43(1) on September 30, 2013.","July 29, 2009","BIT Algeria - Denmark 1999","",295
"245","ARB/09/13","International Company for Railway Systems (ICRS)","Hashemite Kingdom of Jordan","Concluded","International Company for Railway Systems (ICRS) (Jordanian), Privatization Holding Company (PHC) (Kuwaiti)","Settlement agreed by the parties (Order taking note of the discontinuance issued by the Tribunal on February 22, 2011, pursuant to ICSID Arbitration Rule 43(1)).","July 16, 2009","BIT Jordan - Kuwait 2001, ","Contract",294
"246","ARB/09/12","Pac Rim Cayman LLC","Republic of El Salvador","Pending","Pac Rim Cayman LLC (U.S.)","","June 15, 2009","","CAFTA-DR (Dominican Republic-Central America Free Trade Agreement), Investment Law - El Salvador (1999)",293
"247","ARB/09/11","Global Trading Resource Corp. and Globex International, Inc.","Ukraine","Concluded","Global Trading Resource Corp. (U.S.), Globex International,  Inc. (U.S.)","Award rendered on December 1, 2010.","June 11, 2009","BIT Ukraine - United States of America 1994","",292
"248","ARB/09/10","EVN AG","Macedonia, former Yugoslav Republic of","Concluded","EVN AG (Austrian)","Settlement agreed by the parties and settlement recorded at their request in the form of an award (Award embodying the parties' settlement agreement rendered on September 2, 2011, pursuant to ICSID Arbitration Rule 43(2)).","June 3, 2009","BIT Macedonia,  Former Yugoslav Republic of - Austria 2001, ","ECT (Energy Charter Treaty)",291
"249","ARB/09/9","Adem Dogan","Turkmenistan","Pending","Adem Dogan (German)","Award rendered on August 12, 2014.","May 22, 2009","BIT Germany - Turkmenistan 1997","",290
"250","ARB/09/8","KT Asia Investment Group B.V.","Republic of Kazakhstan","Concluded","KT Asia Investment Group B.V. (Dutch)","Award rendered on October 17, 2013.","May 20, 2009","BIT Netherlands - Kazakhstan 2002","",289
"251","ARB/09/7","MTN (Dubai) Limited and MTN Yemen for Mobile Telephones","Republic of Yemen","Concluded","MTN (Dubai) Limited (United Arab Emirates), MTN Yemen for Mobile Telephones (Yemeni)","Settlement agreed by the parties and settlement recorded at their request in the form of an award (Award embodying the parties' settlement agreement rendered on June 25, 2010, pursuant to ICSID Arbitration Rule 43(2)).","May 1, 2009","BIT United Arab Emirates - Yemen,  Republic of 2001, ","Investment Law - Yemen (2002)",288
"252","ARB/09/5","Iberdrola Energía, S.A.","Republic of Guatemala","Concluded","Iberdrola Energía,  S.A. (Spanish)","Award rendered on August 17, 2012.","April 17, 2009","BIT Spain - Guatemala 2002","",287
"253","ARB/09/6","Vattenfall AB, Vattenfall Europe AG, Vattenfall Europe Generation AG","Federal Republic of Germany","Concluded","Vattenfall AB (Swedish), Vattenfall Europe AG (German), Vattenfall Europe Generation AG & Co. KG (German)","Settlement agreed by the parties and settlement recorded at their request in the form of an award (Award embodying the parties' settlement agreement rendered on March 11, 2011, pursuant to ICSID Arbitration Rule 43(2)).","April 17, 2009","","ECT (Energy Charter Treaty)",286
"254","ARB/09/4","Elsamex, S.A.","Republic of Honduras","Concluded","Elsamex,  S.A. (Spanish)","Award rendered on November 16, 2012.","April 15, 2009","","Contract",285
"255","ARB/09/3","Holcim Limited, Holderfin B.V. and Caricement B.V.","Bolivarian Republic of Venezuela","Pending","Caricement B.V. (Dutch), Holcim Limited (Swiss), Holderfin B.V. (Dutch)","","April 10, 2009","BIT Venezuela,  Republica Bolivariana de - Switzerland 1993, BIT Netherlands - Venezuela,  Republica Bolivariana de 1991","",284
"256","ARB/09/2","Deutsche Bank AG","Democratic Socialist Republic of Sri Lanka","Pending","Deutsche Bank AG (German)","Award rendered on October 31, 2012; attached to the award is a dissenting opinion by arbitrator Makhdoom Ali Khan.","March 24, 2009","BIT Germany - Sri Lanka 2000","",283
"257","ARB/09/1","Teinver S.A., Transportes de Cercanías S.A. and Autobuses Urbanos del Sur S.A.","Argentine Republic","Pending","Autobuses Urbanos del Sur S.A. (Spanish), Teinver S.A. (Spanish), Transportes de Cercanías S.A. (Spanish)","","January 30, 2009","BIT Spain - Argentina 1991","",282
"258","ARB/08/19","Karmer Marble Tourism Construction Industry and Commerce Limited Liability Company","Georgia","Concluded","Karmer Marble Tourism Construction Industry and Commerce Limited Liability Company (Turkish)","The Tribunal renders its award on August 9, 2012.","December 31, 2008","BIT Turkey - Georgia 1992","",281
"259","ARB/08/20","Millicom International Operations B.V. and Sentel GSM S.A.","Republic of Senegal","Concluded","Millicom International Operations B.V. (Dutch), Sentel GSM S.A. (Senegalese)","Settlement agreed by the parties and settlement recorded at their request in the form of an award (Award embodying the parties' settlement agreement rendered on November 27, 2012, pursuant to ICSID Arbitration Rule 43(2)).","December 31, 2008","BIT Senegal - Netherlands 1979, ","Contract",280
"260","ARB/08/18","Malicorp Limited","Arab Republic of Egypt","Concluded","Malicorp Limited (British)","Award rendered on February 7, 2011.","December 16, 2008","BIT Egypt,  Arab Republic of - United Kingdom of Great Britain and Northern Ireland 1975","",279
"261","ARB/08/17","Participaciones Inversiones Portuarias SARL","Gabonese Republic","Concluded","Participaciones Inversiones Portuarias Sàrl (Luxembourg)","The Tribunal issues an order taking note of the discontinuance of the proceeding pursuant to  ICSID Administrative and Financial Regulation 14(3)(d) on January 10, 2011. 
","December 16, 2008","BIT Belgium-Luxembourg - Gabon 1998, ","Investment Law - Gabon (1998)",278
"262","UNCT/10/2","Apotex Inc.","United States of America","Concluded","Apotex Inc. (Canadian)","Award on Jurisdiction and Admissibility rendered on June 14, 2013.","December 10, 2008","","NAFTA (North American Free Trade Agreement)",277
"263","ARB/08/16","GEA Group Aktiengesellschaft","Ukraine","Concluded","GEA Group Aktiengesellschaft (German)","Award rendered on March 31, 2011.","November 21, 2008","BIT Ukraine - Germany 1993","",276
"264","ARB/08/15","CEMEX Caracas Investments B.V. and CEMEX Caracas II Investments B.V.","Bolivarian Republic of Venezuela","Concluded","CEMEX Caracas Investments B.V. (Dutch), CEMEX Caracas II Investments B.V. (Dutch)","The Tribunal issues an order taking note of the discontinuance of the proceeding pursuant to ICSID Arbitration Rule 43(1) on February 15, 2012.","October 30, 2008","BIT Netherlands - Venezuela,  Republica Bolivariana de 1991, ","Investment Law - Venezuela (1999)",275
"265","ARB/08/14","Impregilo S.p.A.","Argentine Republic","Concluded","Impregilo S.p.A. (Italian)","The Tribunal issues an order for the
discontinuance of the proceeding pursuant ICSID Arbitration Rule 43(1) on October 27, 2010.","October 15, 2008","BIT Argentina - Italy 1990","",274
"266","ARB/08/13","Alapli Elektrik B.V.","Republic of Turkey","Concluded","Alapli Elektrik B.V. (Dutch)","The Tribunal renders its award; attached to the award is a dissenting opinion by arbitrator Marc Lalonde on July 16, 2012.","August 27, 2008","BIT Netherlands - Turkey 1986, ","ECT (Energy Charter Treaty)",273
"267","ARB/08/12","Caratube International Oil Company LLP","Republic of Kazakhstan","Concluded","Caratube International Oil Company LLP (Kazakhstani)","Award rendered on June 5, 2012.","August 26, 2008","BIT United States of America - Kazakhstan 1992","",272
"268","ARB/08/11","Bosh International, Inc. and B&P, LTD Foreign Investments Enterprise","Ukraine","Concluded","Bosh International,  Inc. (U.S.), B&P,  Ltd. Foreign Investments Enterprise (Ukrainian)","The Tribunal renders its award on October 25, 2012.","August 21, 2008","BIT Ukraine - United States of America 1994","",271
"269","ARB/08/10","Repsol YPF Ecuador, S.A. and others","Republic of Ecuador and Empresa Estatal Petróleos del Ecuador (PetroEcuador)","Concluded","CRS Resources (Ecuador) LDC (British), Murphy Ecuador Oil Company,  Ltd. (British), Overseas Petroleum and Investment Corporation (Panamanian), Repsol YPF Ecuador,  S.A. (Spanish)","The Tribunal issues an order taking note of the discontinuance of the proceeding pursuant to ICSID Arbitration Rule 43(1) on February 9, 2011.","August 8, 2008","","Contract",270
"270","ARB/08/9","Ambiente Ufficio S.p.A. and others","Argentine Republic","Concluded","Ambiente Ufficio S.p.A. and others (nationality not available)","Order for the discontinuance of the proceeding for lack of payment of the required advances, pursuant to ICSID Administrative and Financial Regulation 14(3)(d), issued on May, 28, 2015; attached to the order is an individual statement by arbitrator Santiago Torres Bernárdez.","July 28, 2008","BIT Argentina - Italy 1990","",269
"271","ARB/08/8","Inmaris Perestroika Sailing Maritime Services GmbH and others","Ukraine","Concluded","Inmaris Perestroika Sailing Maritime Services GmbH (German), Inmaris Windjammer Chartering GmbH i.L. (German), Inmaris Windjammer Sailing GmbH i.L. (German), Windjammer Beteiligungsgesellschaft mbH & Co. KG (German)","Award rendered on March 1, 2012.","June 16, 2008","BIT Ukraine - Germany 1993","",268
"272","ARB/08/7","Itera International Energy LLC and Itera Group NV","Georgia","Concluded","Itera Group NV (Dutch), Itera International Energy LLC (U.S.)","The Tribunal issues an order taking note of the discontinuance of the proceeding pursuant to ICSID Arbitration Rule 43(1).","June 5, 2008","BIT United States of America - Georgia 1994, BIT Georgia - Netherlands 1998","",267
"273","ARB/08/6","Perenco Ecuador Limited","Republic of Ecuador","Pending","Perenco Ecuador Limited (Bahamian)","","June 4, 2008","BIT France - Ecuador 1994, ","Contract",266
